id,address,longitude,latitude
2011972883,株洲市天元区庐山路159号城市风景6栋108（128）号,113.123938,27.834589
2011971962,株洲市荷塘区太阳村吴家冲组,113.179016,27.850118
2011970532,株洲市石峰区铜藕路散户84号,113.109968,27.880374
2011970554,株洲市荷塘区仙庾镇黄塘商业街168号,113.240387,27.948093
2011970346,株洲市芦淞区五里墩茅屋街殷建兵私宅,113.198784,27.802429
2011970347,株洲市芦淞区人民南路366号星期八大厦103、104号门面,113.155800,27.837082
2011970350,株洲市荷塘区新华西路89号14-17号门面,113.165381,27.844658
2011970366,株洲市天元区珠江南路珠江花园22号,113.123050,27.807875
2011970375,株洲市荷塘区仙庾镇蝶屏村小乡组,113.230035,27.933862
2011970372,株洲市芦淞区董家塅三三一中航怡园地下室—113号,113.185898,27.789421
2011970363,株洲市荷塘区合泰大街合泰花园112号,113.163196,27.833742
2011970379,株洲市芦淞区人民南路486号,113.155275,27.838842
2011970360,株洲市天元区徐家冲管理处一队散户,113.132474,27.812983
2011970358,株洲市石峰区云龙示范区盘龙路999号株洲碧桂园2栋116室,113.160812,27.894466
2011970368,株洲市芦淞区堤升大厦一期工程底楼4号,113.152724,27.785070
2011970359,株洲市荷塘区合泰五中路口,113.164581,27.837593
2011970356,株洲市天元区炎帝大道金轮翡翠名园13栋102、202号,113.089161,27.792113
2011970376,株洲市芦淞区太子路1726号锦绣江山9、10栋附107号,113.154141,27.821211
2011970370,株洲市石峰区云龙示范区云龙大道磐龙小区11栋1号门面,113.187504,27.922664
2011970378,株洲市天元区炎帝大道金彩明天5栋4号,113.091681,27.792150
2011970374,株洲市芦淞区七斗冲湖南珠华机械厂门面,113.176338,27.773329
2011970364,株洲市天元区群丰镇新塘村,113.087724,27.722278
2011970377,株洲市荷塘区文化路775号金域半岛2栋114号、115号门面,113.166424,27.843384
2011970354,株洲市芦淞区神龙公园7、8号门面,113.140100,27.846834
2011970361,株洲市荷塘区新华西路水竹一村29栋,113.170496,27.851463
2011970369,株洲市荷塘区裕丰广场商住楼104号,113.165190,27.834711
2011970348,株洲市荷塘区宏源楼4号门面,113.204740,27.878151
2011970389,株洲市芦淞区建设中路曦美苑大厦518号111门面,113.139539,27.848806
2011970384,株洲市荷塘区荷塘铺乡荷塘铺村（金钩山路663号）,113.176752,27.850344
2011970371,株洲市芦淞区谭家塅王家冲组贺国秋私宅,113.160660,27.797910
2011970382,株洲市荷塘区裕丰公司佳苑小区928-3栋5号门面,113.164635,27.829756
2011970399,株洲市荷塘区湘运路56号金馨花园商业及地下室—115号门面,113.177303,27.855316
2011970394,株洲市天元区群丰镇江璜社区胜塘组,113.097301,27.729090
2012970357,株洲市石峰区时代路108号时代国际住宅小区16栋3-8层,113.129077,27.900180
2011970402,株洲市石峰区田心街道叫鸡岭社区横塘坡组,113.136219,27.871028
2011970386,株洲市天元区天元区圆方路180号,113.128435,27.821826
2011970381,株洲市芦淞区结谷街小门面,113.157012,27.830678
2011970390,株洲市天元区明日路美的蓝溪谷住宅小区16栋114号,113.080712,27.837298
2011970380,株洲市荷塘区文化路775号金域半岛3栋120,113.166190,27.842664
2011970403,株洲市天元区长江南路东侧湘银、紫竹茗园6、8栋102号,113.140344,27.814680
2011970398,株洲市石峰区康复路响石三村18栋106号,113.112945,27.872688
2011970383,株洲市天元区新泰小区12号门面,113.103726,27.828371
2011970407,株洲市荷塘区太阳村郭家祠堂华地小区15栋2号杂屋,113.166649,27.847664
2011970412,株洲市荷塘区合泰路398号亚泰时代广场一楼2号门面（原102号门面）,113.163356,27.835449
2011970405,株洲市荷塘区宝庆路28号东湖商务大酒店及东湖大厦101号,113.162197,27.832038
2011970406,株洲市天元区神农文化休闲街B地块4、5栋4#1层E-111号,113.118150,27.824240
2011971967,株洲市天元区泰山路办事处渡口九队,113.128110,27.818482
2011971708,株洲市荷塘区仙庾镇联星村松林塘组,113.256390,27.909393
2011971282,株洲市荷塘区仙庾镇夏家段村下荷叶组027号,113.240009,27.947363
2011971283,株洲市荷塘区明照乡锦龙小区27栋一层101、102号,113.180281,27.846965
2011971275,株洲市石峰区株化生活区一区47栋车库,113.094290,27.885994
2011971267,株洲市石峰区田心泉塘湾小区（顺安苑）一栋一层内铺,113.127594,27.892478
2011971258,株洲市芦淞区龙泉路服装厂1栋1号门面,113.167090,27.824870
2011971263,株洲市石峰区石峰区清石路68号,113.091139,27.893237
2011971279,株洲市芦淞区建宁乡南华村芦家组罗学春私宅,113.173865,27.772588
2011972375,株洲市荷塘区仙庾镇联星村赵家组018号,113.256390,27.909393
2011972392,株洲市荷塘区仙庾镇黄塘村毛言山组,113.236895,27.960029
2011972394,株洲市荷塘区仙庾镇黄塘村熊家冲下屋组,113.236895,27.960029
2011971278,株洲市荷塘区钻石路49号综合楼附104号,113.158483,27.842813
2011971268,株洲市云龙示范区学林办事处三冲村11号,113.162181,27.887530
2011971271,株洲市天元区黄河北路湘银星城2.2地下室107号,113.112862,27.830532
2011971269,株洲市天元区莲花路锦绣华都5栋106号,113.101699,27.835553
2011971276,株洲市天元区泰山东路28号水陌华庭103--15号门面,113.141021,27.823761
2011971285,株洲市芦淞区太子路1398号百江花园28栋103号门面,113.160155,27.811333
2011971281,株洲市石峰区建设北路521号樱花地带4栋102号,113.119187,27.865738
2011971274,株洲市荷塘区石宋路37栋2号门面,113.177682,27.847184
2011971277,株洲市芦淞区九天布辅市场沿江临街2--259号,113.153043,27.830250
2011972427,株洲市株洲云龙示范区龙头铺街道办事处鸡嘴山社区铁路塘组社区办公楼1号门面,113.147848,27.949529
2011972408,株洲市株洲云龙示范区云田镇莲花社区莲花安置房小区D3栋13号,113.197186,27.977127
2012970963,株洲市天元区炎帝大道北侧加油站站房,113.083992,27.790780
2012970966,株洲市芦淞区人民路87号,113.137286,27.855156
2011971043,株洲市天元区群丰镇江璜村正明组,113.096647,27.729227
2011970588,株洲市芦淞区株董路268号静园山庄3栋114号,113.177938,27.812006
2011970606,株洲市天元区长江南路阳光小区11栋101号,113.140991,27.817263
2011970598,株洲市荷塘区石宋路295号8栋101门面,113.177058,27.839901
2011970616,株洲市芦淞区龙泉街道办事处龙泉村新铺子游春华私宅,113.176754,27.819348
2011970623,株洲市芦淞区五里墩乡朱田铺村石屋组汤忠良私宅,113.196089,27.821458
2011970635,株洲市芦淞区解放街建宁购物公园商铺1.2号楼129号门面,113.154319,27.825940
2011970610,株洲市芦淞区人民中路1006号宏桥凯旋名门8栋109室,113.138515,27.854128
2011970612,株洲市天元区新闻路汇达花园6栋101号门面,113.126663,27.827202
2011970627,株洲市石峰区田心高科园安置房（1栋2.、3、4、5号门面）,113.129680,27.909376
2011970644,株洲市荷塘区红旗中路437-6号,113.161345,27.861155
2011970634,株洲市荷塘区新华东路丰子塘街道27号（现新华东路1383号）,113.174952,27.856225
2011970605,株洲市荷塘区金钩山路金钩山小区1号楼-212号（28号门面）,113.177333,27.854572
2012970924,株洲市荷塘区合泰大街73栋一单元801号,113.167301,27.838738
2011971369,株洲市天元区园方路190号刘绍六私房,113.082216,27.826867
2011971305,株洲市石峰区响石九组2号（区法院斜对面）,113.108284,27.857280
2011971290,株洲市荷塘区天鹅花园33栋11号车库,113.146075,27.853074
2011971354,株洲市芦淞区龙泉村杜家组刘菊英私宅,113.172994,27.824311
2011972925,株洲市荷塘区新华西路313号门面,113.157833,27.841286
2011971367,株洲市天元区圆方路35号,113.128390,27.819500
2011971307,株洲市天元区黑龙江路提香蓝岸6.7栋119号,113.080323,27.822377
2011970391,株洲市芦淞区车站路1号门面,113.154597,27.834965
2011970418,株洲市天元区炎帝大道36号金彩明天5栋6号,113.091681,27.792150
2011970410,株洲市芦淞区董家塅高科园家和制衣厂厂房90号,113.176379,27.785612
2011970392,株洲市石峰区建设北路株冶老生活区内怡心大厦（7号）,113.098116,27.885514
2011970397,株洲市芦淞区白关镇国际服饰城8栋112号,113.241758,27.813209
2011970415,株洲市天元区张家园4队,113.144485,27.817500
2011970417,株洲市荷塘区湖南工业大学老校区学生创业楼11号门面,113.173063,27.830459
2011970411,株洲市荷塘区红旗广场新荷家园商住楼101号,113.171950,27.854250
2011970414,株洲市天元区江山路恒豪翠谷城2栋,113.087182,27.826834
2011970432,株洲市天元区黄河南路安置房小区2栋附108号（8号门面）,113.133917,27.811652
2011970416,株洲市石峰区先锋路23号昱峰花园14栋101号,113.117680,27.873660
2011970428,株洲市荷塘区红旗中路456号嘉盛华府4栋101号门面,113.163272,27.864591
2011970424,株洲市天元区栗雨南路春藤小镇4栋101号,113.087957,27.792446
2011970393,株洲市天元区栗雨王家坪村,113.094841,27.802424
2011970373,株洲市芦淞区姚家坝乡梢光铺村桥背组,113.152724,27.785070
2011970426,株洲市石峰区响石三村18栋105号,113.112945,27.872688
2011970400,株洲市天元区雷打石镇胜塘村和平组29号,113.122254,27.723637
2011970365,株洲市石峰区株化医院门口,113.099323,27.879391
2011131378,株洲市芦淞区建设南路20号,113.154231,27.828441
2011131365,株洲市天元区庐山路136号庐山春天5栋,113.120484,27.834839
2011131406,株洲市石峰区田心北门新民二村12号门面,113.128213,27.895330
2012000397,株洲市石峰区田心,113.127207,27.895084
2011131367,株洲市荷塘区仙庾镇夏家塅村上荷叶组,113.232486,27.948940
2011130044,株洲市荷塘区新塘坡村一组,113.160330,27.860115
2011131748,株洲市荷塘区东环新城12栋48号,113.179260,27.832060
2011130054,株洲市金三角市场鞋楼一楼153号,113.157983,27.828894
2011130038,株洲市荷塘区东湖路佳苑小区1栋,113.163838,27.831366
2011130024,株洲市天元区颐景园小区1栋113室,113.085299,27.825067
2011131283,株洲市天元区马家河镇新马村,113.037978,27.829297
2011131333,株洲市荷塘区新华东路湖南煤田地质局水工环勘探队临街756号门面,113.184319,27.868892
2011130100,株洲市田心东门迎东商贸街A1号门面,113.127669,27.859998
2011130068,株洲市天元区王家坪街道73号,113.099068,27.802611
2011130021,株洲市天元区亲亲家园5栋1号门面,113.133634,27.835664
2011131287,株洲市荷塘区四三0农贸市场4号门面,113.173487,27.855929
2011131249,株洲市荷塘区新塘坡安置房21号,113.161587,27.865450
2011130101,株洲市芦淞区东景紫映10号门面,113.139566,27.847228
2011131749,株洲市芦淞区董家塅欣月佳园二期力源尚品1栋1号,113.191970,27.805988
2011130022,株洲市天元区金域天下二期5栋101号商铺,113.075650,27.832654
2011130052,株洲市天元区湘山路98号三兴华府龙苑1栋102室,113.104021,27.833747
2011130053,株洲市天元区莲花小区7栋莲031-2,113.100268,27.840906
2011131320,株洲市天元区三门镇喜玲商店,113.108366,27.601080
2011131088,株洲市石峰区清水塘株化生活区49栋2号门面,113.095097,27.886044
2011131257,株洲市芦淞区新芦淞服装工业园51栋1楼钱建祥私宅,113.168887,27.827590
2011131403,株洲市天元区渌江路760号凿石花园安置房小区9栋,113.133200,27.804782
2011131321,株洲市天元区株洲大道68号万家理想5栋106室,113.118719,27.842843
2011130087,株洲市芦淞区太子路43号湘江四季花园14栋103号,113.152996,27.818511
2011130027,株洲市荷塘区新华东路756号向阳村,113.181980,27.867230
2011131350,株洲市荷塘区荷塘铺乡荷塘铺村新店子组044号,113.174728,27.840265
2011129427,株洲市芦淞区五里墩乡白井村竹塘组002号,113.152724,27.785070
2011129426,株洲市芦淞区五里墩乡关口村西瓜组001号,113.210526,27.795114
2011129429,株洲市荷塘区东环新城46栋117号,113.181961,27.831368
2011129434,株洲市荷塘区文化路书香里3栋29号,113.176180,27.830576
2011129435,株洲市石峰区建设北路138号清石嘉苑1、2、3栋,113.096809,27.886139
2011129455,株洲市天元区珠江南路珠江丽园21栋121号,113.125694,27.804662
2011129453,株洲市天元区泰山西路瀚水栗源18栋14号车库,113.111336,27.811213
2011129449,株洲市天元区湘滨村龙形组,113.119078,27.732520
2011129445,株洲市芦淞区幸福村人防办1号门面,113.158167,27.824103
2011129442,株洲市荷塘区株洲运佳运输有限公司2、3号门面,113.173487,27.855929
2011129443,株洲市芦淞区五里墩乡关口村钟家湾组026号,113.210526,27.795114
2011129450,株洲市芦淞区株董路1368号南方印象1栋103号,113.184150,27.795444
2011129456,株洲市荷塘区株铁供应段制材厂办公楼一楼,113.173487,27.855929
2011129452,株洲市荷塘区石宋路大众家园4、5栋,113.179176,27.853209
2011129459,株洲市天元区长江南路华天新村109号门面,113.138660,27.827821
2011129486,株洲市芦淞区姚家坝乡姚家坝村,113.330722,27.769702
2011129485,株洲市芦淞区姚家坝乡姚家坝村新站组,113.330722,27.769702
2011129471,株洲市荷塘区新华东路附49号,113.176848,27.858119
2011129500,株洲市荷塘区东环新城32栋16号,113.180125,27.830480
2011129502,株洲市荷塘区红旗中路25号,113.167288,27.857697
2011129469,株洲市芦淞区庆云山综合楼门面7.8号,113.161400,27.819500
2011129498,株洲市荷塘区石宋路太阳新村2栋35号,113.173588,27.839412
2011129464,株洲市芦淞区百江明珠11栋111号门面,113.159690,27.813390
2011129499,株洲市荷塘区红旗村24栋103号门面,113.166382,27.857351
2011129493,株洲市荷塘区东环新城45栋01号,113.180847,27.830451
2011129481,株洲市天元区天台路市政府5号门面,113.133030,27.828682
2011129473,株洲市天元区莲花小区7栋Z32-6号门面,113.100268,27.840906
2011129517,株洲市荷塘区戴家岭芙蓉冲组散户,113.190070,27.878770
2011129440,株洲市石峰区建设村大塘湾1号,113.103700,27.878570
2011129463,株洲市天元区株洲大道68号尚格名城二期20号110号,113.119858,27.840339
2011129532,株洲市芦淞区太子路1219号裕景龙苑1栋104号门面,113.160873,27.806562
2011129504,株洲市芦淞区建宁乡龙泉村余家冲组,113.172994,27.824311
2011129511,株洲市芦淞区太子路1398号百江花园14栋109号,113.160190,27.813188
2011129524,株洲市芦淞区人民中路610号28、29号门面,113.146047,27.848761
2011129467,株洲市天元区三门镇株木村,113.090187,27.593400
2011129489,株洲市天元区颐景园小区22栋104门面,113.085902,27.827194
2011129521,株洲市荷塘区新塘村安置户140-3号门面,113.173487,27.855929
2011129503,株洲市荷塘区新华东路239号岭秀天下2栋101室,113.194037,27.875822
2011129505,株洲市天元区马家河镇月塘小区A片区19号门面,113.070974,27.819226
2011129495,株洲市荷塘区玫瑰名城丁香苑1、2、3栋,113.172116,27.861103
2011129506,株洲市天元区湘芸路月塘二期安置小区10栋1号门面,113.072362,27.776994
2011129494,株洲市天元区群丰镇响塘村竹山组,113.077918,27.787408
2011129527,株洲市荷塘区东环北路288号三一歌雅郡8栋106号门面,113.177925,27.870237
2011129534,株洲市荷塘区裕丰广场B区007号,113.165190,27.834711
2011129571,株洲市石峰区清石路广汇小区4号楼4栋113号,113.095530,27.892575
2011129540,株洲市芦淞区人民中路10栋101号,113.153634,27.840945
2011129575,株洲市荷塘区石宋路财富小区17栋,113.178444,27.842792
2011129550,株洲市天元区德政花苑13栋附102、103号门面,113.125865,27.832736
2011129548,株洲市天元区中达路9号公租房2号门面,113.077370,27.816906
2011129557,株洲市天元区明日路17号3号公寓,113.086643,27.836320
2011129546,株洲市天元区尚格名城1期15号楼101号,113.119242,27.838722
2011129566,株洲市芦淞区龙泉村窑棚子组042号,113.172994,27.824311
2011129545,株洲市芦淞区大京风景区苦竹村,113.263792,27.829644
2011129528,株洲市芦淞区姚家坝乡姚家坝村基塘组,113.330722,27.769702
2011129529,株洲市姚家坝乡张家湾村围子组09号,113.350842,27.805887
2011129470,株洲市荷塘区新华东路239号岭秀天下2栋108号,113.194037,27.875822
2011129592,株洲市荷塘区育才路鑫泰大楼103号门面,113.164225,27.838423
2011129568,株洲市芦淞区庆云山路风林绿洲小区107、108号门面,113.161107,27.817139
2011129577,株洲市天元区泰山路师专教工住宅10栋301号杂物间,113.128544,27.817632
2011129574,株洲市天元区滨江北路789号富基滨江公园7栋202室,113.102863,27.841851
2011129579,株洲市云龙示范区红旗北路田心大丰村57号,113.155079,27.888516
2011129601,株洲市荷塘区合泰裕丰1区16栋,113.173487,27.855929
2011129567,株洲市石峰区田心东门车站路玉澜小区403号门面,113.127207,27.895084
2011129595,株洲市荷塘区新华东路6号东方花园12栋116号门面,113.172314,27.855059
2011129598,株洲市荷塘区石宋路295号10栋5单元（财富地带）,113.176363,27.840382
2011129589,株洲市石峰区清水塘湘天桥百货商场（清水路）,113.092452,27.882874
2011129606,株洲市荷塘区明照乡戴家岭村戴家岭组,113.189623,27.873495
2011129578,株洲市荷塘区文化路德民小区东环新城75栋,113.178827,27.830200
2011129587,株洲市芦淞区南方公司仁和天城107号门面,113.188944,27.800060
2011129630,株洲市芦淞区农兴桥新桥组,113.179104,27.791300
2011129618,株洲市荷塘区金钩山村次周湾组,113.184095,27.857753
2011129604,株洲市天元区黄河北路567号金质颐园1栋101号门面,113.112692,27.830619
2011129593,株洲市天元区泰华二村3栋南3号门面,113.137180,27.831709
2011129617,株洲市荷塘区金钩山村藕塘冲组,113.184095,27.857753
2011129560,株洲市天元区三门镇上节街,113.108510,27.601600
2011129580,株洲市天元区雷打石镇仙鹅村新塘组,113.056611,27.647353
2011129607,株洲市荷塘区明照乡新市村,113.223704,27.851996
2012000330,株洲市荷塘区仙庾镇夏家塅村,113.232486,27.948940
2011129624,株洲市天元区广厦路广厦新村临街2号门面,113.129827,27.837605
2011129608,株洲市芦淞区人民中路20号103、104号门面,113.152803,27.840191
2011129619,株洲市荷塘区十三中周家屋场6栋1号门面,113.177092,27.849949
2011129623,株洲市芦淞建设中路804号（原白石港街道),113.132539,27.853454
2011129599,株洲市天元区湘依路创业服务中心科研楼1层104号,113.131531,27.818872
2011129609,株洲市天元区泰山路金泰园小区门面,113.132962,27.818831
2011129512,株洲市芦淞区五里墩乡白井村昂公祠组西瓜001号（原昂公祠组017号）,113.152724,27.785070
2011129513,株洲市芦淞区五里墩乡白井村昂公祠组006号,113.152724,27.785070
2011129516,株洲市芦淞区五里墩乡白井村竹塘组018号,113.152724,27.785070
2011129613,株洲市荷塘区合泰银基小区9栋107号门面,113.164000,27.832082
2011129663,株洲市荷塘区石宋路银基小区25栋101号,113.165565,27.830898
2011129612,株洲市荷塘区合泰裕丰1区9栋,113.173487,27.855929
2011129669,株洲市荷塘区合泰银基小区2栋,113.163089,27.832726
2011129668,株洲市荷塘区合泰银基小区3栋108号,113.163750,27.832596
2011129651,株洲市芦淞区太子路925号枫溪小区2号楼44、45号门面,113.156338,27.795488
2011129656,株洲市芦淞区老1815线燎原新村私房,113.154638,27.792727
2011129634,株洲市芦淞区服装工业园36栋101号,113.152724,27.785070
2011129660,株洲市荷塘区明照乡星星村新屋湾021号,113.208002,27.881815
2011129645,株洲市天元区明日路美的城二期4栋101号门面,113.084149,27.835779
2011129673,株洲市芦淞区龙泉村洪家冲计生委旁1号门面,113.172994,27.824311
2011129679,株洲市天元区株洲大道68号尚格名城二期7栋108号,113.121108,27.841209
2011129682,株洲市天元区黄河南路11号富景园小区5栋111号门面,113.135320,27.818250
2011129648,株洲市石峰区田心北门九方牡丹园M-7、M-8号,113.132700,27.887069
2011129662,株洲市白关镇大岭村墓炉组,113.269785,27.781121
2011129643,株洲市芦淞区新芦淞工业园53栋1号门面,113.152724,27.785070
2011129666,株洲市天元区明珠路湘银世纪花园12栋1号门面,113.127692,27.838307
2011129659,株洲市天元区黄河北路金质颐园4栋104号,113.113785,27.830123
2011129625,株洲市芦淞区盛世路29号地税新村1栋6号门面,113.155775,27.813438
2011129640,株洲市石峰区清石广场北都大厦一楼门面,113.097586,27.888632
2011129672,株洲市芦淞区建设南路徐家桥商业步行街时代广场1层101号,113.154981,27.834749
2011129678,株洲市芦淞区姚家坝乡同化寺村,113.326525,27.812140
2011129713,株洲市荷塘区新华东路496号东方丽都2栋104号,113.186976,27.871725
2011129685,株洲市芦淞区大京风景名胜区残梅村王麦组04号,113.263792,27.829644
2011129709,株洲市芦淞区白关镇大岭村大岭组,113.269785,27.781121
2011129686,株洲市芦淞区大京风景名胜区残梅村马头组30号,113.263792,27.829644
2011129710,株洲市天元区雷打石镇公道街,113.074978,27.678472
2011129695,株洲市芦淞区贺嘉路10号贺家土大市场内壹楼1156号铺,113.143742,27.849629
2011129711,株洲市荷塘区红旗南路锦龙小区44栋17号,113.181219,27.845325
2011129697,株洲市荷塘区东湖路佳苑小区14栋1楼,113.164423,27.830483
2011129704,株洲市芦淞区太子路1398号百江花园24、25栋106号,113.161038,27.812138
2011129626,株洲市芦淞区龙泉村塘头组,113.166819,27.823605
2011129689,株洲市芦淞区欣月佳园二期1栋109号门面,113.191922,27.805703
2011129722,株洲市芦淞区泰亨路15栋1楼门面,113.170887,27.821875
2011129699,株洲市芦淞区姚家坝乡同化寺村庙湾组11号,113.326525,27.812140
2011129721,株洲市荷塘区新华西路89号市政小区8栋107号,113.165582,27.844777
2011129708,株洲市荷塘区仙庾镇东山村东山组,113.248931,27.957650
2011129690,株洲市荷塘区蝶屏乡黄塘商品街,113.243626,27.954454
2011129736,株洲市石峰区田心东门办事处7号门面,113.127207,27.895084
2011129741,株洲市天元区黄河南路11号富景园小区11-12栋103号,113.134048,27.819427
2011129746,株洲市天元区马家河镇太高社区同心7号,113.048517,27.759962
2011129728,株洲市天元区群丰镇湘云社区三组,113.116085,27.741685
2011129851,株洲市芦淞区市府路17号南玉综合楼12号门面,113.158330,27.831109
2011129891,株洲市天元区泰山路12号8号门面,113.142060,27.822827
2011129933,株洲市芦淞区龙泉村友好组散户,113.172994,27.824311
2011129899,株洲市荷塘区荷塘铺村,113.174728,27.840265
2011129945,株洲市天元区黄山路388号华晨御园6栋110号,113.127538,27.812681
2011129874,株洲市荷塘区仙庾镇仙庾村召党组(刘光跃私房）,113.247974,27.936624
2011129930,株洲市荷塘区湘运南路金钩山花园495号,113.179888,27.854068
2011129939,株洲市天元区圆方路,113.129064,27.822365
2011129892,株洲市天元区泰山西路1399号龙腾国际2栋108号,113.102515,27.812114
2011129951,株洲市天元区珠江南路天泰小区门面,113.124238,27.810362
2011129903,株洲市天元区泰山西路工业大学西街16号,113.081598,27.814342
2011129907,株洲市天元区长江南路紫竹茗园6、8栋106号门面,113.140344,27.814680
2011129872,株洲市天元区马家河镇泉源村古竹组11号,113.057775,27.796041
2011129861,株洲市芦淞区曲尺乡碧玉花园梅园区1-9号门面,113.158455,27.804407
2011129894,株洲市天元区马家河镇太高村湖家组3号,113.043797,27.758808
2011129877,株洲市荷塘区荷塘铺乡荷塘铺村向阳组（现文化路石子头社区散户245号）,113.171780,27.842523
2011129878,株洲市芦淞区建宁开发区菜种组周结果私房,113.152724,27.785070
2011129893,株洲市芦淞区株董路9号日盛、城南星座1、2栋109号门面,113.175949,27.815893
2011129940,株洲市芦淞区董家塅高科园雨斯厂门面,113.176379,27.785612
2011129902,株洲市天元区滨江南路科艺花园6栋104号门面,113.144317,27.815211
2011129815,株洲市天元区泰山西路工业大学一组团学生综合服务中心A栋188号门面,113.081598,27.814342
2011040383,株洲市天元区韶山东路保利花园5栋5号,113.136179,27.832940
2011131747,株洲市天元区尚格名城13栋114号,113.119017,27.841225
2011131345,株洲市荷塘区红港路汽车城A区3、4栋1-205号,113.151879,27.862539
2011120006,株洲市天元区马家河镇新马村新付组,113.037978,27.829297
2011120317,株洲市天元区马家河镇浅塘村,113.099552,27.785132
2011131256,株洲市芦淞区龙泉村洪家冲组吴化荣私宅,113.172994,27.824311
2011110373,株洲市芦淞区市中兴针织服装厂正面右1号,113.152724,27.785070
2011110213,株洲市芦淞区锻压小区8号门面,113.166348,27.819562
2011129285,株洲市石峰区田心北门田红路112号8栋107号,113.130467,27.887484
2011129293,株洲市石峰区田心北门曹村田红路A-24号,113.130310,27.886986
2011131304,株洲市芦淞区董家塅迎新路1-5号门面,113.186640,27.796032
2012000024,株洲市石峰区清水路,113.091419,27.883082
2011131306,株洲市天元区雷打石镇私云组,113.074978,27.678472
