id,address,longitude,latitude
2011971707,株洲市芦淞区董家塅中航怡园2栋107号,113.185494,27.789437
2011971661,株洲市天元区湘江大桥南侧亚都花园B栋25号门面,113.140060,27.829059
2011971695,株洲市荷塘区新华东路98号3栋121号,113.179698,27.862825
2011971730,株洲市石峰区田心街道田心村上曾家冲组80号,113.140538,27.883765
2011971729,株洲市荷塘区钻石路1号门面,113.158982,27.842976
2011971686,株洲市荷塘区中兴小区办公楼左边房屋一间,113.187052,27.868716
2011971702,株洲市天元区牛形山路,113.136628,27.821977
2011971711,株洲市天元区雷打石镇龙塘村苏家组25号,113.109446,27.695460
2011971709,株洲市天元区长江北路金碧华庭商住楼116-121号,113.134979,27.833223
2011971716,株洲市芦淞区王塔冲机房仓库,113.164720,27.842047
2011971726,株洲市荷塘区金钩山银泰百合嘉园13号楼,113.180636,27.853987
2011971656,株洲市荷塘区东湖农贸市场1号门面,113.167033,27.832598
2011971719,株洲市云龙示范区云田镇云峰湖社区鸟卜组凌意私房,113.218517,27.986753
2011971725,株洲市芦淞区解放街建宁购物公园3号楼127、227号门面,113.157163,27.824631
2012971186,株洲市芦淞区太子路927号加油站,113.155290,27.793680
2011971722,株洲市荷塘区东湖路佳苑小区14栋103号,113.164423,27.830483
2011971717,株洲市天元区株洲大道68号尚格名城香榭丽舍1栋107号,113.118354,27.841902
2011971688,株洲市天元区栗雨工业园D-11区楠湖山庄5栋3号,113.092059,27.827834
2011971732,株洲市荷塘区天鹅路366号天鹅国际住宅小区4栋102号,113.145599,27.857668
2011971582,株洲市芦淞区建宁乡杨柳冲陈家塘看守所2栋101号,113.166150,27.817129
2011971751,株洲市荷塘区桂花路56号,113.173067,27.857134
2011971626,株洲市芦淞区白关镇宋家湾村兴塘组15号,113.243105,27.787879
2011971734,株洲市芦淞区建设南路68号胜马可商业广场1-118号,113.154609,27.826990
2011971764,株洲市天元区花园二村2栋202号,113.130355,27.831353
2011971762,株洲市芦淞区建宁乡龙泉村窑棚组谭艳平私宅,113.172994,27.824311
2011971678,株洲市芦淞区贺家土人民中路83号1栋,113.139925,27.852839
2011971775,株洲市天元区长江北路耀华楼106号,113.134908,27.830670
2011971735,株洲市天元区张家园15号（泰山路富景园小区东门）,113.134530,27.819687
2011971641,株洲市云龙示范区湖南化工学院一食堂一楼,113.160642,27.903426
2011971666,株洲市云龙示范区湖南化工学院二食堂一楼,113.112711,27.818805
2011971746,株洲市天元区雷打石镇沙江村八斗组,113.074978,27.678472
2011971747,株洲市天元区珠江南路湘水湾商业馆内,113.124192,27.800482
2011971741,株洲市新华西路999号钟鼓岭首层中央美食尚外铺B-19号铺位,113.155532,27.837734
2011971773,株洲市荷塘区新华东路654号门面,113.184319,27.868892
2011971737,株洲市芦淞区芦淞路896号门面,113.164782,27.820787
2011971767,株洲市荷塘区裕丰大楼B栋门面,113.173487,27.855929
2011971665,株洲市荷塘区仙庾镇黄塘村商品街,113.243626,27.954454
2011971760,株洲市云龙示范区崇文路450号就业指导中心1栋一层101号,113.161876,27.902476
2011971739,株洲市芦淞区果园路8号新芦淞服装工业园30栋一楼6、7号门面,113.167592,27.826701
2011971752,株洲市荷塘区向阳广场北赵家冲村天天向上1栋105、106号,113.178453,27.869078
2011971755,株洲市荷塘区明照乡东流村小塘组,113.206030,27.920812
2011971776,株洲市石峰区湘天桥农贸市场内（A1号摊位）,113.101269,27.886359
2011971742,株洲市天元区渡口十一队,113.082216,27.826867
2011971774,株洲市天元区炎帝大道金轮翡翠名园13栋104、204号,113.089161,27.792113
2011971753,株洲市石峰区建设北路521号樱花地带3栋105,113.118653,27.865635
2011971738,株洲市芦淞区建宁经济开发区一条街散户殷立明私宅,113.152724,27.785070
2011971771,株洲市荷塘区仙庾镇蝶屏村马福组散户,113.230035,27.933862
2011971744,株洲市天元区泰山路228号动力大楼东门厅,113.131449,27.819657
2011971733,株洲市芦淞区芦淞芦157号商住楼,113.152724,27.785070
2011971758,株洲市天元区株洲大道666号旺城天悦13栋102号门面,113.098043,27.841060
2011971596,株洲市天元区黄山路天源纺织有限责任公司三产公司,113.139138,27.813404
2011971772,株洲市芦淞区太子路1219号裕景龙苑15栋105号门面,113.160649,27.806428
2011971763,株洲市天元区株洲大道68号尚格名城二期1号楼105号,113.121156,27.839820
2011971645,株洲市石峰区人民北路9号综合楼101号,113.134994,27.857425
2011971766,株洲市天元区黄河南路康馨佳园6栋9号,113.134949,27.810328
2011971756,株洲市石峰区兴城大厦8号,113.097473,27.882571
2011971736,株洲市芦淞区芦淞区人民中路学堂冲二村17-4栋113号,113.149767,27.841681
2011971759,株洲市石峰区铜塘湾清竹社区八一组（康复医院旁）,113.110517,27.880165
2011971740,株洲市芦淞区高家坳楠竹社区28栋107号门面,113.180478,27.816638
2011971718,株洲市芦淞区白关镇玉泉村潘公塘14号,113.241758,27.813209
2011971690,株洲市天元区天元超市门口邮政书报亭,113.136312,27.827771
2011971731,株洲市天元区群丰镇石塘村金塘组01号,113.035521,27.753705
2011971668,株洲市荷塘区宋家桥街道办事处龙洲村枞树岭组01号,113.223373,27.875367
2011971651,株洲市天元区泰华一村综合楼12号门面,113.140076,27.828294
2011971770,株洲市芦淞区姚家坝乡卦石村水库组07号,113.302614,27.772771
2011971715,株洲市芦淞区株董路9号日盛城南星座1、2栋112号门面,113.175949,27.815893
2011971794,株洲市天元区黄山路熹悦花都槐微园648号,113.120144,27.810188
2011971795,株洲市荷塘区大坪路243号门面,113.167814,27.847925
2011971757,株洲市石峰区清水塘果园区门店（二）（29号门面）,113.094304,27.891582
2011971793,株洲市芦淞区太子路1398号百江花园13栋110号,113.158468,27.813595
2011971781,株洲市天元区天台横路（圆方路160号）,113.129064,27.822365
2011971723,株洲市荷塘区文化路15号综合楼23-24号门面,113.173278,27.840053
2011971754,株洲市荷塘区玫瑰名城榕树园104号,113.170138,27.863196
2011971779,株洲市天元区雷打石镇沧沙街,113.074978,27.678472
2011971804,株洲市芦淞区建设路和车站路交叉地人和商业广场地下一楼ZZZH-B121a&B121b商铺,113.152736,27.834111
2011971785,株洲市芦淞区太子路1726号锦绣江山9、10栋附104号门面,113.154141,27.821211
2011971791,株洲市芦淞区锦绣江山9栋C单元109号,113.154141,27.821211
2011971787,株洲市石峰区百翔佳园3栋4号,113.114558,27.871279
2011971784,株洲市株洲云龙示范区学林街道办事处双丰社区棉湖洲组34号,113.152506,27.870823
2011971783,株洲市荷塘区新华东路110号综合楼105号,113.180263,27.863755
2012971705,株洲市芦淞区太子路1398号百江花园27栋101号,113.158249,27.812989
2012971704,株洲市芦淞区石宋西路89号丰园商住小区5号楼107、114号门面,113.159491,27.821348
2012971713,株洲市天元区湘依路恒瑞雅园地下室-111号,113.131021,27.814930
2012971706,株洲市芦淞区月形巷23号金碧花园1栋101、102号,113.152851,27.818312
2011971792,株洲市天元区黄河北路100号华尔兹公寓111号（右边）,113.127910,27.828300
2011971684,株洲市荷塘区新华西路106号门面,113.157833,27.841286
2011971745,株洲市芦淞区姚家坝乡卦石村油子冲组,113.302614,27.772771
2011971798,株洲市芦淞区姚家坝乡竹山村塘湾组1号,113.305511,27.789049
2011971749,株洲市芦淞区金冠服饰文化传媒1楼金冠巷临铺3号,113.154757,27.830190
2011971802,株洲市芦淞区建设路学堂冲二村2栋104,113.148728,27.842739
2011971786,株洲市芦淞区五里墩村瓦屋组易要明私宅,113.214588,27.808902
2011971782,株洲市云龙示范区龙头铺镇新街,113.168694,27.918447
2011971780,株洲市荷塘区石宋路东华大厦一单元101号,113.172236,27.836867
2011971712,株洲市天元区长江南路紫竹茗园1栋105号,113.140921,27.815691
2011971799,株洲市芦淞区江南旧货市场一楼附一号 摊位,113.166878,27.821066
2011971803,株洲市天元区渌江路湘江名都1栋,113.121342,27.805006
2011971790,株洲市石峰区霞湾新村上坝组8号,113.102548,27.860220
2011971806,株洲市荷塘区新华东路郭家祠堂散户1号,113.185620,27.865870
2011971823,株洲市荷塘区金钩山路701号大众家园6栋110号,113.178630,27.853606
2011971826,株洲市芦淞区人民中路75号1楼（原人民路18栋）一层,113.142747,27.850931
2011971810,株洲市荷塘区富家垅康力工业园10栋（B区32栋）,113.173487,27.855929
2011971822,株洲市芦淞区白关国际服饰产业园10栋,113.241758,27.813209
2011971768,株洲市石峰区田心迎东商贸街B24号门面,113.132177,27.882846
2011971778,株洲市荷塘区合泰银基小区十一栋A单元一楼,113.164415,27.831406
2011971765,株洲市石峰区田心村上曾家冲44号,113.140538,27.883765
2011971796,株洲市天元区雷打石镇砖桥村石子头组23号,113.098723,27.699995
2011971721,株洲市天元区明日路美的蓝溪谷住宅小区16栋113号门面,113.080712,27.837298
2011971825,株洲市天元区庐山路136号庐山春天早安华晨16栋106号,113.121168,27.832706
2011971835,株洲市荷塘区仙庾镇樟桥村三吉组,113.259872,27.988576
2011971821,株洲市天元区黄河北路858号山河锦园10栋111号门面,113.099037,27.831102
2011971800,株洲市天元区雷打石镇砖桥村石子头组（株23（B）集建（96）字第2-47号）,113.098723,27.699995
2011971834,株洲市荷塘区新华东路23号千金5号门面,113.174589,27.856163
2011971801,株洲市天元区泰山路天玺湾8栋101号,113.085326,27.812631
2011971809,株洲市芦淞区七一路湘安3栋1楼10号门面,113.149128,27.841828
2011971814,株洲市荷塘区湖南工业大学大学创业楼1号门面,113.106981,27.818084
2011971807,株洲市芦淞区解放街建宁购物公园时代广场110号门面,113.154319,27.825940
2011971827,株洲市芦淞区芦淞路157号办公楼2号门面,113.166496,27.819350
2011971830,株洲市石峰区井龙街道茅太新村新屋洲组25号,113.129316,27.899407
2011971819,株洲市荷塘区桂花路7号外海玫瑰名城百合苑2、3栋120号（20号商铺）,113.173272,27.859141
2011971820,株洲市芦淞区建设南路219号国宾酒店停车场旁,113.153969,27.832745
2011971832,株洲市石峰区田心村十五组,113.140538,27.883765
2011971815,株洲市石峰区红旗路849号莱茵小镇21栋-104号门面,113.132375,27.891500
2011971824,株洲市芦淞区芦淞路111号12号门面,113.160881,27.822506
2011971833,株洲市石峰区湘天桥农贸市场(B1号摊位),113.101269,27.886359
2011971808,株洲市荷塘区东湖路佳苑小区16栋102号,113.164423,27.830483
2011971679,株洲市芦淞区曲尺乡曲尺村毛栗坪组邓君发私宅,113.124285,27.776954
2011971813,株洲市荷塘区路口东环新城46栋121号商铺,113.181961,27.831368
2011971811,株洲市荷塘区新华东路239号,113.194036,27.875876
2011971831,株洲市荷塘区湘运南路509号金钩山金钩花园1栋109号,113.181900,27.853748
2011971836,株洲市芦淞区建设中路688号文化园三期1、2栋101号,113.136671,27.853090
2011971216,株洲市芦淞区沿江中路8号大汉悦中心购物中心A区F层AF112号,113.149023,27.838177
2011971817,株洲市天元区滨江休闲广场一桥下,113.140921,27.831180
2011971828,株洲市荷塘区文化路90号门面,113.190022,27.832397
2012971630,株洲市芦淞区董家塅友好村841号,113.176379,27.785612
2012971633,株洲市天元区仙月环路899号新马动力创新园F19栋02号一楼,113.029652,27.801854
2011971829,株洲市荷塘区红港路汽车城B区8、9栋2号商铺（户室号1-202号）,113.153292,27.862461
2011971714,株洲市荷塘区明照街道东园村勤俭组001号,113.173487,27.855929
2011971676,株洲市荷塘区麻园二组35号,113.173487,27.855929
2011971517,株洲市芦淞区建设南路延伸段湘江四季花园7、8栋综合楼3号门面,113.153937,27.819244
2011971852,株洲市荷塘区纺织东路塑料五厂16号门面,113.141553,27.854138
2011971788,株洲市荷塘区荷塘铺村居民小区散户102号,113.174728,27.840265
2011971853,株洲市芦淞区龙泉村罗家冲组董伟波私房,113.172994,27.824311
2011971863,株洲市天元区雷打石镇青石街,113.074978,27.678472
2011971662,株洲市石峰区建设北路1928号门面,113.117740,27.869550
2011971851,株洲市芦淞区湘安小区17栋1号门面,113.151383,27.841646
2011971840,株洲市天元区天台横路11队圆方68号,113.127411,27.822998
2011971859,株洲市芦淞区董家塅中华仁家2栋B02号杂物间,113.189258,27.799165
2011971842,株洲市荷塘区合泰小区C区3栋5单元101号,113.166010,27.838631
2011971838,株洲市石峰区清水塘街道白马村打冲组,113.079488,27.920210
2011971761,株洲市荷塘区政府一号楼临街桂花路七号门面,113.173463,27.856056
2011971865,株洲市芦淞区芦淞路192号（中外酒楼）临街门面,113.171691,27.817440
2011971816,株洲市芦淞区龙泉村余家冲尾王庸定私房,113.172994,27.824311
2011971818,株洲市天元区珠江南路珠江丽园4栋13号,113.126421,27.806131
2011971866,株洲市芦淞区白关镇玉泉村大屋组36号,113.241758,27.813209
2011971858,株洲市市芦淞区建宁乡南华村易苏组罗艳私宅,113.173865,27.772588
2011971890,株洲市天元区天台支路临街门面,113.082216,27.826867
2011971261,株洲市石峰区田心街道田心村田心物流园路口,113.140538,27.883765
2011971848,株洲市天元区大坪街道韶山路38、40号,113.133226,27.831023
2011971849,株洲市天元区国脉家园2栋101号,113.127395,27.824918
2011971860,株洲市石峰区田红路曹四村5栋-101号,113.133888,27.887721
2011971861,株洲市芦淞区纺织路6号1栋104号门面,113.140780,27.852660
2011971843,株洲市芦淞区建宁乡龙泉村易家洲袁雨花私宅,113.172994,27.824311
2011971871,株洲市荷塘区金山工业园内,113.173487,27.855929
2011971844,株洲市天元区莲花路668号竹山小区二期31栋,113.098923,27.828638
2011971874,株洲市荷塘区石子湖公园木屋三号门面,113.167780,27.838390
2011971894,株洲市芦淞区白关镇大岭村大岭组09号,113.269785,27.781121
2011971710,株洲市芦淞区淞华市场二楼停车场门口,113.154567,27.829283
2011971882,株洲市荷塘区新塘路1599号金色荷塘7栋103、104号,113.169590,27.861978
2011971891,株洲市荷塘区育才路（新华西路）617号,113.163644,27.843949
2011971885,株洲市云龙示范区红旗北路226号时代云龙城8栋111号门面,113.146728,27.874813
2011971879,株洲市荷塘区东湖路48号金豪大厦112号,113.166546,27.832740
2011971864,株洲市天元区雷打石镇砖桥村,113.098723,27.699995
2011971857,株洲市芦淞区建设南路108号家润多广场二楼旺角名城2F2号商铺,113.152533,27.836934
2011971839,株洲市荷塘区晨光小区,113.172978,27.838472
2011971888,株洲市荷塘区荷塘铺乡荷塘铺村新店子组,113.174728,27.840265
2011971889,株洲市云龙示范区盘龙路999号碧桂园观澜7栋101号,113.159866,27.894965
2011971854,株洲市荷塘区新华东路50号纺织大厦食堂,113.175172,27.857094
2011971896,株洲市云龙示范区云田镇五星社区榕树花园6栋40号门面,113.201366,27.996087
2011971876,株洲市荷塘区红旗南路锦龙小区1栋临街门面,113.179520,27.847600
2011971881,株洲市荷塘区新华东路71号新园小区商住楼1楼5号门面（户室号105号）,113.181056,27.862075
2011971872,株洲市荷塘区石子湖公园九号售货亭,113.173487,27.855929
2011971845,株洲市天元区火炬二路金域天下三期11栋,113.075828,27.836078
2011971743,株洲市天元区炎帝广场银座大厅右侧,113.122759,27.820705
2011971855,株洲市芦淞区董家塅中华二路1号仁和天城109号门面,113.187744,27.800138
2011971867,株洲市天元区黄山路388号华晨御园2栋104号,113.129476,27.813972
2011971873,株洲市荷塘区合泰路与文化路交汇处金山大厦4号门面,113.170090,27.841018
2011971877,株洲市芦淞区湘大路中田山语城3栋C22号,113.171192,27.797963
2011971868,株洲市云龙示范区红旗北路348号凯风珑城3栋103室,113.142475,27.876558
2011971918,株洲市荷塘区戴家岭村新屋湾组106号,113.173487,27.855929
2011971928,株洲市芦凇区香竹园小区l栋附2号房,113.134002,27.827550
2011971903,株洲市石峰区井龙办事处太平寺村,113.117981,27.904159
2011971925,株洲市天元区泰山西路瀚水栗源3栋401号附属3--9号杂屋,113.110624,27.812330
2011971917,株洲市荷塘区金山路618号金山家园1栋-103,113.187510,27.864826
2011971926,株洲市天元区庐山路69号庐山恋综合楼,113.122942,27.836949
2011971898,株洲市天元区株洲大道383号和顺天河广场一期3栋112号,113.101716,27.837234
2011971924,株洲市天元区株洲大道383号型格广场3栋113号商铺,113.101716,27.837234
2011971919,株洲市云龙示范区红旗北路链条厂门面,113.140623,27.877868
2011971850,株洲市芦淞区神龙公园原游泳池老房101号,113.140100,27.846834
2011971912,株洲市荷塘区仙庾镇黄塘商品街,113.243626,27.954454
2011971934,株洲市荷塘区蝶屏乡柏冲村细柏冲组028号,113.206401,27.959288
2011971933,株洲市荷塘区仙庾镇柏冲村,113.206401,27.959288
2011971935,株洲市云龙示范区云田镇莲花社区秧塘组005号,113.197186,27.977127
2011971904,株洲市石峰区李家冲村14栋116号,113.117732,27.875445
2011971927,株洲市天元区三门镇黄田村新湾组,113.049768,27.529812
2011971837,株洲市荷塘区合泰街39栋103号,113.158738,27.831426
2011971902,株洲市石峰区田心东门恒丰小区6栋101号,113.135969,27.878006
2011971922,株洲市荷塘区蝶屏乡香草塘村香子庵组001号,113.261063,27.929942
2011971921,株洲市荷塘区新塘路1200号郦城1、2栋115号,113.171853,27.869123
2011971900,株洲市荷塘区荷塘铺乡荷塘铺村262号,113.174728,27.840265
2011971895,株洲市天元区三门镇月福村廖家组04号,113.108366,27.601080
2011971914,株洲市石峰区株洲三友铸造材料厂沿街10号门面,113.122610,27.894224
2011971846,株洲市天元区马家河镇中路村,113.048929,27.832373
2011971880,株洲市荷塘区文化路晨光小区3栋101号,113.172044,27.839877
2011971915,株洲市荷塘区红旗中路456号嘉盛华府32栋104,113.164365,27.863897
2011971905,株洲市芦淞区解放街幸福村老干所门面,113.158167,27.824103
2011971929,株洲市天元区株洲大道和顺天河广场期商业裙楼及地下室147号,113.082951,27.829252
2011971941,株洲市荷塘区新华西路119号水竹一村26栋1001号,113.170114,27.850743
2011971948,株洲市株洲云龙示范区学林街道办事处三冲社区9组10号,113.154713,27.873304
2011971951,株洲市天元区隆兴路156号美的城18栋117、221号、,113.082878,27.831908
2011971950,株洲市芦淞区大冲口,113.162553,27.819751
2011971949,株洲市芦凇区盛世路山水国际后门易正根私宅,113.152437,27.813299
2011971952,株洲市芦凇区建设南路255号金龙大酒店保安岗亭,113.153950,27.834564
2011971907,株洲市天元区明日路美的蓝溪谷住宅小区52栋102号门面,113.080712,27.837298
2011971937,株洲市芦淞区芦淞路129号（原芦淞株渌路口）,113.172677,27.816587
2011971960,株洲市荷塘区黄泥塘临街拐角楼2号门面,113.171550,27.865710
2011971942,株洲市荷塘区市渔场藕塘冲6号,113.173487,27.855929
2011971943,株洲市石峰区响田东路258号新源l小区13栋l号,113.120374,27.873376
2011971913,株洲市石峰区响石岭生活区改造工程（金地佳家旺）门面21号,113.115900,27.870150
2011971916,株洲市荷塘区新华西路276号,113.168231,27.848296
2011971957,株洲市天元区泰山路徐家冲管理处1队,113.132474,27.812983
2011971938,株洲市荷塘区荷塘铺乡戴家岭村新屋湾组散户,113.151664,27.867389
2011971909,株洲市芦淞区人民中路610号24、25号门面,113.146047,27.848761
2011971959,株洲市天元区三门镇月形村长乐组12号,113.064672,27.580777
2011971899,株洲市荷塘区湘运南路509号金钩花园l栋110号,113.181891,27.853345
2011971953,株洲市芦凇区建宁乡龙泉村友好组王新明私宅,113.432752,27.332645
2011971936,株洲市荷塘区天鹅花园别墅2区7号,113.173487,27.855929
2011971961,株洲市芦淞区芦淞路航空路云山诗意l栋标2号,113.151665,27.769676
2011971931,株洲市芦淞区火车站南侧行包房隔壁消防通道旁边,113.156671,27.834620
2011971965,株洲市荷塘区新华西路9l号市政大厦104号,113.166417,27.844994
2011971940,株洲市芦淞区码头社区9栋前坪,113.152339,27.830818
2011971971,株洲市天元区桂花城5栋116、117号,113.078692,27.808636
2011971972,株洲市荷塘区新塘坡村磨湾塘组013号,113.160330,27.860115
2011971969,株洲市天元区黑龙江路58号,113.068709,27.841034
2011971973,株洲市天元区黄河南路98号东鼎紫园2栋108号门面,113.134271,27.806135
2011971958,株洲市芦淞区枫溪办事处七斗冲珠华机械公司车库,113.173360,27.767948
2011971955,株洲市芦凇区芦淞眼装都市工业园5,113.134002,27.827550
2011971947,株洲市芦凇区白关镇宋家湾村村部,113.243105,27.787879
2011971974,株洲市芦淞区建设南路88号庆云山庄紫南阁4号楼附104号,113.155547,27.815703
2011971968,株洲市荷塘区新华西路80号荷叶大楼103号,113.170326,27.851839
2011971897,株洲市荷塘区明照乡星星村老屋湾组022号,113.207085,27.885421
2011971976,株洲市芦淞区建宁乡龙泉村万辉娥私宅4、5号门面,113.172994,27.824311
2011971911,株洲市荷塘区新华东路ll4号l栋13号,113.184319,27.868892
2011971975,株洲市天元区群丰镇栗山村新力组,113.068652,27.722501
2011971893,株洲市芦淞区五里墩乡白井村竹塘组016号,113.152724,27.785070
2011971884,株洲市芦淞区火车站邮政局前邮政报亭,113.156110,27.831968
2011971932,株洲市芦淞区建宁开发区洪家组易平私宅,113.152724,27.785070
2011971945,株洲市云龙示范区兴隆农贸市场27号门面,113.157169,27.910991
2011971805,株洲市天元区长江北路117号湘银小区20栋22号门面,113.125608,27.837741
2011971939,株洲市天元区学前路大红桎园18栋20号,113.119553,27.808525
2011971944,株洲市石峰区井龙街道茅太新村高科园安置小区,113.129316,27.899407
2011971956,株洲市荷塘区天鹅花园19栋104房,113.145947,27.855163
2011971963,株洲市芦凇区人民中路宏侨凯旋名门9栋1-6号门面,113.137187,27.855325
2011971964,株洲市荷塘区裕丰广场4区1栋,113.164919,27.833094
2011971966,株洲市荷塘区锦龙小区,113.180900,27.846216
2011971970,株洲市天元区雷打石镇胜塘村坝塘组17号,113.122254,27.723637
2011971977,株洲市芦凇区荷叶冲路68号德政江南世家1栋103号,113.167338,27.820999
2011971979,株洲市洲市石峰区建设北路487号万塘村21-22栋1楼443号,113.123654,27.862179
2011971980,株洲市荷塘区仙庾岭镇黄塘村黄塘商品街107-108号,113.243626,27.954454
2011971981,株洲市荷塘区新华东路1423号东融大厦103号,113.174269,27.856889
2011971983,株洲市天元区黄山路344号华晨御园4栋106号,113.129091,27.812928
2011971984,株洲市天元区衡山中路湘江名都8、9栋115号,113.120776,27.805581
2011971985,株洲市芦凇区贺家土农贸大市场一层副食区45号,113.134002,27.827550
2011972000,株洲市芦淞区建宁经济开发区散户王伟峰私宅,113.152724,27.785070
2011971910,株洲市荷塘区褡丰路褡丰广场3区15栋层746号,113.173487,27.855929
2011971995,株洲市芦凇区果园路8号新芦凇服装I业园1栋邓淑云、钱德许私宅,113.167592,27.826701
2011971999,株洲市芦淞区建宁乡龙泉村塘头组龙罗仙私宅,113.166819,27.823605
2011972010,株洲市芦凇区龙泉村新铺子组排子山王应伟私宅,113.172994,27.824311
2011971987,株洲市芦凇区春满园综合经营部临街门面5--7号,113.134002,27.827550
2011971990,株洲市芦凇区谭家煅安置小区一排5栋一号门面,113.134002,27.827550
2011972007,株洲市荷塘区文化路晨光小区6栋108号,113.173036,27.839170
2011972011,株洲市天元区炎帝广场北侧公园大道B栋106号,113.121867,27.823241
2011972003,株洲市石峰区田心建设村24栋5号门面,113.134690,27.877948
2011972012,株洲市荷塘区新华西路34号103-1号,113.159290,27.841990
2011971993,株洲市天元区莲花小区1栋101号门面,113.099848,27.840939
2011971996,株洲市天元区长江北路湘银小区门面2期第1栋103号,113.134000,27.831500
2011971989,株洲市芦凇区株洲摩托厂迎新路5栋6号门面,113.185618,27.794764
2011972005,株洲市芦凇区五三机械厂侧门口,113.134002,27.827550
2011971997,株洲市芦淞区文革桥石屋组杉树坡宾海源私宅,113.192978,27.821493
2011972001,株洲市荷塘区太阳村吴家冲组,113.179016,27.850118
2011972009,株洲市石峰区清石路101号融城雅园14栋一层101号门面,113.093781,27.892838
2011972002,株洲市荷塘区向阳踣366号东部美的城1期14栋104号,113.174376,27.873939
2011972006,株洲市荷塘区新华东路6号东方花园8栋202,113.172451,27.856356
2011971988,株洲市天元区长江南路187号共和城9栋106,113.138500,27.815387
2011971991,株洲市天元区泰山路泰山西村l栋57号,113.123790,27.815673
