id,address,longitude,latitude
2063107111,醴陵市玉瓷路56号,113.488643,27.667679
2063107107,醴陵市玉瓷路67号,113.489113,27.667466
2063218283,醴陵市东富镇石里浦村肖家老屋组,113.558933,27.670421
2063105328,醴陵市来龙门办事处三刀石8号,113.513879,27.663851
2063106330,醴陵市解放路东段8号附2号门面,113.509610,27.670765
2063205350,醴陵市明月镇贺市村桥上组1号,113.354000,27.409546
2063106142,醴陵市妇幼保健院传达室门面,113.506472,27.666059
2063106268,醴陵市来龙门办事处大桥北路环卫处13号,113.502230,27.661153
2063106169,醴陵市城东市场18号门面,113.504547,27.663267
2063106275,醴陵市烈士塔横塘31号,113.509009,27.664639
2063106160,醴陵市来龙门办事处解放路66号,113.505560,27.663115
2063106181,醴陵市烈士塔温馨家园11号门面,113.504641,27.663159
2063208310,醴陵市均楚镇岱兴桥村岱兴桥组,113.205043,27.500311
2063106148,醴陵市解放路湘运汽车站旁,113.507879,27.664783
2063102085,醴陵市李畋西路D栋19号,113.497834,27.662834
2063106284,醴陵市陶瓷烟花市场临解放路33号,113.508560,27.673182
2063106124,醴陵市解放路东段液化气公司后门面,113.510719,27.671070
2063106116,醴陵市瓷城大道142号,113.509597,27.668607
2063106288,醴陵市金融路邮政局门口,113.508933,27.669273
2063107012,醴陵市来龙门办事处青云北路27号,113.501067,27.661952
2063107004,醴陵市来龙门办事处青云北路21号,113.502566,27.660432
2063218362,醴陵市白兔潭镇玄武大道北三区4-5号,113.674848,27.789019
2063107030,醴陵市电瓷厂马放塘3号门面,113.508230,27.668571
2063103028,醴陵市阳三办事处阳三石菜市场旁边,113.520514,27.654044
2063103065,醴陵市阳三办事处向阳社区立三路,113.548530,27.669025
2063103070,醴陵市阳三石永胜厂后门,113.496894,27.646130
2063103052,醴陵市阳三办事处向阳社区,113.548530,27.669025
2063103059,醴陵市阳三石办事处向阳社区,113.524072,27.657367
2063103077,醴陵市阳三办事处向阳社区,113.548530,27.669025
2063101002,醴陵市仙岳山街道左权南路141号,113.511950,27.637136
2063103072,醴陵市阳三石办事处向阳社区22栋1号门面,113.524072,27.657367
2063103102,醴陵市阳三市场内,113.496894,27.646130
2063103123,醴陵市阳三石办事处阳三石路7号,113.530728,27.653866
2063103118,醴陵市阳三石菜市场,113.520514,27.654044
2063103110,醴陵市阳三办事处泉湖企业公司门面,113.548530,27.669025
2063103155,醴陵市阳三办事处立三村,113.548530,27.669025
2063103137,醴陵市阳东村洲上组20号,113.534529,27.656542
2063103134,醴陵市阳三石办事处红星小区89号,113.519513,27.651640
2063103153,醴陵市玉屏山村深塘组37号,113.520903,27.640851
2063107059,醴陵市陶瓷研究所对面,113.504318,27.671599
2063107063,醴陵市陶瓷研究所对面青云北路315号,113.498292,27.666957
2063217834,醴陵市东富镇四杨社区鹅公岭组,113.557691,27.603771
2063107067,醴陵市来龙门办事处五里牌村东岸组,113.507838,27.684320
2063118125,醴陵市姜湾新街25号,113.493952,27.664024
2063107204,醴陵市建安市场内,113.496894,27.646130
2063118023,醴陵市滨河路48号3栋102,113.496992,27.659589
2063118029,醴陵市姜湾下正街13号,113.494803,27.664262
2063107172,醴陵市新街口6号,113.496762,27.655997
2063209253,醴陵市板杉乡土株岭村李西组,113.447766,27.715009
2063118043,醴陵市姜湾上正街77号,113.497727,27.658834
2063118047,醴陵市姜湾老街143号,113.495493,27.664640
2063118057,醴陵市姜湾上正街149号,113.498000,27.660500
2063118098,醴陵市姜湾下正街3号,113.492250,27.664519
2063118100,醴陵市姜湾上正街东风大酒店附一楼接通道门面116号,113.496584,27.656902
2063201165,醴陵市王仙镇建设路194号,113.591692,27.736875
2063218969,醴陵市解放路烈士塔近家湖17号,113.509009,27.664639
2063118154,醴陵市西山办事处江源村4号门面,113.491264,27.658349
2063217831,醴陵市板杉乡八步桥村燕子坡组18号,113.408006,27.757002
2063201049,醴陵市王仙镇王仙村商贸街,113.592059,27.731866
2063107047,醴陵市电瓷厂马放塘1号,113.499150,27.664523
2063118186,醴陵市姜湾上正街45号,113.497555,27.658108
2063118164,醴陵市星火瓷厂食堂门面,113.479230,27.661349
2063201211,醴陵市东堡乡樟段村连塘组,113.517322,27.702827
2063203005,醴陵市沩山镇新东堡村梨子塘组,113.524570,27.716100
2063203068,醴陵市沩山镇青泉村八块组208号,113.524570,27.716100
2063203065,醴陵市沩山镇新东堡村新庵23号,113.524570,27.716100
2063217858,醴陵市栗山坝镇龙井居委会,113.350710,27.546249
2063203070,醴陵市东堡乡樟段村,113.517322,27.702827
2063203056,醴陵市沩山镇大林村油榨组253号,113.556898,27.728211
2063217837,醴陵市沩山镇大林村铺上组,113.556898,27.728211
2063201226,醴陵市李畋镇富里社区36号,113.677167,27.851721
2063203048,醴陵市东堡乡大林村铺上组,113.556898,27.728211
2063217855,醴陵市明月镇盐山村盐山组,113.452587,27.479703
2063208337,醴陵市均楚镇樟桥村,113.288151,27.577099
2063201132,醴陵市王仙镇建设路118号,113.591692,27.736875
2063201044,醴陵市王仙镇王仙社区建设路67号,113.591692,27.736875
2063218337,醴陵市板杉乡红光村陈家湾组,113.416472,27.687091
2063201032,醴陵市王仙镇建设路193号,113.591160,27.735943
2063201147,醴陵市王仙镇马桥村苏家组,113.595042,27.785924
2063201155,醴陵市王仙镇香水村新庙组,113.607892,27.706964
2063217842,醴陵市明月镇贺市村湖里组,113.354649,27.409873
2063201157,醴陵市王仙镇司徒村仲公祠组306号,113.583782,27.724008
2063207338,醴陵市石亭镇石亭居委会,113.257269,27.623863
2063201137,醴陵市王仙镇庄埠村,113.574281,27.693343
2063201177,醴陵市王仙镇三狮村竹小塘组192号,113.610211,27.735225
2063201185,醴陵市王仙镇书堂村文联组76号,113.578487,27.733844
2063201186,醴陵市王仙镇书堂村山下组143号,113.578487,27.733844
2063202103,醴陵市浦口镇天符社区居委会谢屋组10号,113.641437,27.764093
2063201246,醴陵市浦口镇李洲村浦口老街,113.654884,27.754229
2063202020,醴陵市浦口镇大桥居委会一组195号,113.641437,27.764093
2063203230,醴陵市王仙镇王仙社区居委会建设路,113.591692,27.736875
2063202085,醴陵市浦口镇贯古居委会二组,113.641437,27.764093
2063202027,醴陵市浦口镇大桥居委会二组132号,113.641437,27.764093
2063217841,醴陵市来龙门办事处滨河路〈瓷城拍卖公司旁〉,113.589559,27.736192
2063202033,醴陵市王坊乡联盟村,113.653880,27.744497
2063202034,醴陵市王坊镇联盟村,113.653880,27.744497
2063208339,醴陵市均楚镇荷叶坝村,113.225483,27.525319
2063217832,醴陵市官庄镇官庄村毛山组,113.496894,27.646130
2063202039,醴陵市浦口镇王坊村青山组,113.650480,27.737731
2063107229,醴陵市国瓷街道五里牌村新建组,113.494862,27.675884
2063202086,醴陵市浦口镇王坊村建新组308号,113.650480,27.737731
2063202066,醴陵市王仙镇灌冲村灌店组,113.647360,27.721140
2063202044,醴陵市王坊镇温泉村,113.625141,27.712248
2063202043,醴陵市王仙镇温泉村新街组,113.625141,27.712248
2063218970,醴陵市来龙门办事处瓷城大道馨园小区1栋1-2号门面,113.508698,27.666094
2063202080,醴陵市王仙镇大屏山村金鱼石组,113.660586,27.678293
2063202041,醴陵市王仙镇温泉村狮形组28号,113.625141,27.712248
2063201257,醴陵市王仙镇温泉村渡口组100号,113.625141,27.712248
2063208304,醴陵市均楚镇长岭坳村,113.239787,27.542491
2063201109,醴陵市王坊镇杨林村邓新组,113.626160,27.684963
2063201261,醴陵市王仙镇杨林村牛坊组192号,113.626160,27.684963
2063201125,醴陵市王仙镇迎春商场,113.595890,27.734007
2063201111,醴陵市王仙镇王仙社区居委会建设路347号,113.591692,27.736875
2063209225,醴陵市板杉镇长坡口村,113.443507,27.705294
2063201093,醴陵市王仙镇香水村,113.607892,27.706964
2063201144,醴陵市王仙镇香水村,113.607892,27.706964
2063201130,醴陵市王仙镇香水村,113.607892,27.706964
2063201218,醴陵市白兔潭镇柏大村麻园组34号,113.749260,27.817177
2063201222,醴陵市白兔潭镇山水村上草坪组211号,113.687945,27.774787
2063201223,醴陵市白兔潭镇峤岭才金光组209号,113.699179,27.760577
2063201230,醴陵市富里镇荷田村196号,113.744653,27.811115
2063201178,醴陵市王仙镇清潭村,113.566396,27.709293
2063106352,醴陵市来龙门办事处马脑村长山岭组,113.540092,27.683423
2063203200,醴陵市白兔潭镇长庆村新屋组25号,113.713369,27.811375
2063209240,醴陵市板杉镇擂鼓桥村,113.398776,27.769193
2063201002,醴陵市来龙门办事处珊田村,113.516924,27.681254
2063201006,醴陵市来龙门办事处黄沙村新塘组,113.549966,27.690088
2063201007,醴陵市阳三办事处黄沙村,113.548530,27.669025
2063201077,醴陵市白兔谭镇车站路,113.256581,27.625665
2063201055,醴陵市白兔谭镇金牛路81号,113.496894,27.646130
2063201082,醴陵市白兔潭镇白市居委会金牛路,113.671934,27.791867
2063201071,醴陵市白兔谭镇金牛路1号,113.496894,27.646130
2063208307,醴陵市均楚镇日新桥村,113.204996,27.550003
2063218532,醴陵市东富镇同桥村六斗湾组,113.575816,27.646725
2063201080,醴陵市白兔潭镇洙塘村,113.678775,27.786583
2063201088,醴陵市李畋镇海棠居委会28号,113.496894,27.646130
2063201114,醴陵市来龙门办事处珊田村冷塘组6号,113.516924,27.681254
2063201191,醴陵市李畋镇富里社区居民委员会新街,113.677167,27.851721
2061970013,醴陵市来龙门办事处长庆大道东方家园,113.516788,27.679747
2063209242,醴陵市板杉镇擂鼓桥村,113.398776,27.769193
2063201192,醴陵市李畋镇富里村汉冲坪组463号,113.714786,27.829233
2063201174,醴陵市东堡乡钟鼓村公路组,113.551634,27.695400
2063201197,醴陵市李畋镇富里社区横板组239号,113.677167,27.851721
2063201216,醴陵市白兔潭镇栎塘村大屋二组49号,113.692366,27.786385
2063201254,醴陵市白兔潭镇金牛居委会车站路,113.660200,27.789993
2063218539,醴陵市东富镇龙源冲村（株洲醴陵旗滨玻璃有限公司内）,113.588647,27.617707
2063209223,醴陵市板杉乡土株岭村,113.447766,27.715009
2063201285,醴陵市白兔潭镇栋塘村大屋二组87号,113.674848,27.789019
2063203105,醴陵市李畋镇裕民村四组125号,113.662351,27.848027
2063201269,醴陵市珊田村冷塘组,113.524352,27.680295
2063201205,醴陵市白兔潭镇长庆村黄福垅组190号,113.713369,27.811375
2063201282,醴陵市白兔潭镇柏大村麻园组52号,113.749260,27.817177
2063201259,醴陵市李畋镇富里社区,113.677167,27.851721
2063202108,醴陵市浦口镇河泉村新塘组19号,113.627775,27.741892
2063202009,醴陵市浦口镇花椒村店湾组19号,113.618104,27.758015
2063202075,醴陵市浦口镇浦口村和平组,113.641437,27.764093
2063202088,醴陵市浦口镇仙石村仙石组11号,113.639988,27.794308
2063202092,醴陵市浦口镇花椒村杨家组3号,113.618104,27.758015
2063202099,醴陵市浦口镇三铺村邓家新屋组,113.657280,27.765306
2063201289,醴陵市李畋镇富里社区新街,113.677167,27.851721
2063201292,醴陵市李畋镇富里社区36号,113.677167,27.851721
2063210207,醴陵市板杉镇夏坪桥村袁家冲组,113.412818,27.682161
2063203015,醴陵市南桥镇潼塘村49号,113.702012,27.847058
2063203022,醴陵市李畋镇南桥村新街207号,113.496894,27.646130
2063202101,醴陵市浦口镇碧泉村大塘组13号,113.632608,27.774192
2063203038,醴陵市李畋镇石溪村金平组,113.623938,27.853495
2063203027,醴陵市南桥镇裕民村,113.662351,27.848027
2063203086,醴陵市李畋镇南桥村立新组638号,113.496894,27.646130
2063203084,醴陵市南桥镇南桥村,113.678580,27.844911
2063203085,醴陵市李畋镇南桥社区新街,113.496894,27.646130
2063203076,醴陵市李畋镇凤形村虎形组472号,113.686706,27.870154
2063217839,醴陵市茶山镇筱溪村新屋组19号,113.430110,27.613118
2063201233,醴陵市白兔潭镇荷田村荷田组205号,113.744653,27.811115
2063201235,醴陵市白兔潭镇荷田村横山组219号,113.744653,27.811115
2063201236,醴陵市白兔潭镇荷田村老屋组126号,113.744653,27.811115
2063105142,醴陵市东正街141号,113.503900,27.655192
2063105249,醴陵市东正街172号,113.503411,27.654408
2063205105,醴陵市明月镇东江村和平组16号,113.410156,27.477904
2063205033,醴陵市明月镇马恋村高桥组,113.385794,27.492762
2063205198,醴陵市明月镇天华村东风组,113.496894,27.646130
2063105139,醴陵市来龙门办事处东正街200号,113.509986,27.660103
2063101138,醴陵市阳三办事处城南大道（保养厂对面）,113.518600,27.644596
2063101121,醴陵市立三大道195号,113.515052,27.645862
2063205034,醴陵市大障镇申明村泉江组,113.370538,27.466285
2063101143,醴陵市立三大道(106国道交接处),113.535163,27.655212
2063202050,醴陵市东富镇狮湾村荷连塘组26号,113.628261,27.669947
2063202059,醴陵市东富镇石里浦村竹山组23号,113.558933,27.670421
2063202060,醴陵市东富镇狮湾村,113.628261,27.669947
2063202071,醴陵市东富镇狮湾村上街组,113.628261,27.669947
2063101147,醴陵市城南大道,113.514761,27.650700
2063202113,醴陵市东富镇建新村邓家组27号,113.606420,27.676644
2063209232,醴陵市板杉镇长坡口村,113.443507,27.705294
2063202126,醴陵市东富镇潭湾村,113.585965,27.671620
2063202117,醴陵市枧头洲乡荆潭村,113.565643,27.685712
2063202132,醴陵市东富镇建新村和平组,113.606420,27.676644
2063202147,醴陵市枧头洲乡横烟村,113.598549,27.662649
2063202149,醴陵市东富镇乘前坪村,113.572772,27.655381
2063206169,醴陵市东富镇花木村杨家塘组,113.578031,27.624500
2063206172,醴陵市东富镇叉路口,113.561252,27.609400
2063206108,醴陵市东富镇龙源冲村,113.588647,27.617707
2063206114,醴陵市东富镇龙源冲村,113.588647,27.617707
2063206142,醴陵市东富镇龙源冲村,113.588647,27.617707
2063101162,醴陵市瓷城机械厂宿舍门面,113.505838,27.644779
2063102005,醴陵市财富广场旁边,113.514202,27.652108
2063104186,醴陵市西山办事处江源村河边组34号,113.491264,27.658349
2063206001,醴陵市阳三办事处东门塘村八里坳组,113.548530,27.669025
2063206136,醴陵市东富镇立新村胜吉村组,113.549263,27.627807
2063206160,醴陵市东富镇立新村增家塘组,113.549263,27.627807
2063206162,醴陵市东富镇立新村杨家冲组26号,113.549263,27.627807
2063206107,醴陵市东富镇叉路口,113.561252,27.609400
2063206112,醴陵市东富镇立新村大屋组,113.549263,27.627807
2063206018,醴陵市东富镇叉路口,113.561252,27.609400
2063206078,醴陵市东富镇四杨社区,113.557691,27.603771
2063206002,醴陵市东富镇叉路口,113.561252,27.609400
2063206019,醴陵市东富镇叉路口,113.561252,27.609400
2063206137,醴陵市东富镇寒吉塘组,113.561241,27.608764
2063206133,醴陵市东富镇风仪塘村光明塘组,113.561241,27.608764
2063206012,醴陵市东富镇四杨村,113.561241,27.608764
2063206122,醴陵市东富镇东富村,113.551234,27.559762
2063206124,醴陵市沈潭镇柞市村柑子园组,113.588629,27.489928
2063206066,醴陵市东富镇东富寺,113.561241,27.608764
2063206144,醴陵市沈潭镇新塘村车尾冲组1号,113.561895,27.498995
2061970051,醴陵市黄獭嘴镇黄獭嘴居委会刘家园组,113.424080,27.791270
2063206139,醴陵市沈潭镇沈潭村塘下组14号,113.549770,27.526767
2063206037,醴陵市沈潭镇马坡里居委会27号,113.557841,27.519552
2063206153,醴陵市沈潭镇马坡里村,113.557841,27.519552
2063206141,醴陵市沈潭镇沈潭村邹姑冲组4号,113.549770,27.526767
2063206103,醴陵市沈潭镇双龙村山塘组14号,113.595600,27.512138
2063218527,醴陵市板杉乡夏坪桥村,113.412818,27.682161
2063206074,醴陵市沈潭镇美田桥村,113.623766,27.509657
2063105149,醴陵市东正街28号,113.509986,27.660103
2063105313,醴陵市三刀石18号,113.504967,27.662897
2063105291,醴陵市湘东医院后面,113.505296,27.659965
2063102065,醴陵市大桥南路58号,113.511426,27.656268
2063218541,醴陵市栗山坝镇茶山居委会火炉塘组,113.359838,27.586766
2063105311,醴陵市三刀石16号,113.513879,27.663851
2063205163,醴陵市明月镇江边铺村前进组,113.387629,27.434337
2063205150,醴陵市明月镇江边铺村祠家组3号,113.387629,27.434337
2063101157,醴陵市阳三办事处泉湖路66号,113.512426,27.651310
2063205152,醴陵市明月镇江边铺村胜利组4号,113.387629,27.434337
2063218952,醴陵市南桥镇南桥村32组572号,113.678580,27.844911
2063102011,醴陵市青云南路45号,113.510956,27.656268
2063102015,醴陵市立三路271号,113.518197,27.644845
2063101160,醴陵市左权南路164号,113.509958,27.640987
2063105022,醴陵市湘东食品批发大市场81号,113.506720,27.658472
2063105299,醴陵市来龙门办事处湘东食品大市场49号,113.506412,27.658482
2063105253,醴陵市来龙门办事处湘东食品批发大市场47号,113.506720,27.658472
2063105021,醴陵市湘东食品大市场54号,113.506412,27.658482
2063205155,醴陵市明月镇江边铺村祠家组,113.387629,27.434337
2063118079,醴陵市建国路119号,113.500410,27.651731
2063205112,醴陵市明月镇江边铺村上星组7号,113.387629,27.434337
2063218534,醴陵市滨河路鸿运公寓4号门面,113.495050,27.662386
2063205153,醴陵市明月镇江边铺村富里组3号,113.387629,27.434337
2063118002,醴陵市建国路157号,113.502667,27.655236
2063205211,醴陵市大障镇大障居委会庆贺路,113.421777,27.457946
2063205108,醴陵市明月镇云岩居委会新图组38号,113.496894,27.646130
2063205154,醴陵市明月镇江边铺村土桥组,113.387629,27.434337
2061970052,醴陵市泗汾镇陈家垅村谢家组7号,113.501513,27.522274
2063218554,醴陵市神福港镇长沙岭居委会,113.346231,27.616274
2063105301,醴陵市来龙门办事处解放路46号九州门口,113.776424,26.484715
2063205058,醴陵市贺家桥镇明月居委会,113.496894,27.646130
2063118073,醴陵市胜利路41号,113.499170,27.653206
2063205060,醴陵市贺家桥镇贺市村场坪组,113.354649,27.409873
2063102039,醴陵市湘东市场南街29号,113.496894,27.646130
2063102076,醴陵市青云南路,113.510956,27.656268
2063218493,醴陵市五里牌寨子岭路5号,113.499735,27.673559
2063205057,醴陵市明月镇贺市村桥上组,113.354000,27.409546
2063105090,醴陵市姜湾新街11号门面,113.493952,27.664024
2063102047,醴陵市阳三办事处青山街,113.500664,27.660091
2063205059,醴陵市贺家桥镇贺市村明经组15号,113.355321,27.409411
2063102067,醴陵市阳三办事处泉湖村黄雅塘组,113.500664,27.660091
2063118161,醴陵市建中巷解危解困安居楼,113.497025,27.651778
2063118127,醴陵市太一街市场A栋1号,113.496659,27.652969
2063205111,醴陵市明月镇贺家桥居委会湖塘组,113.362313,27.409550
2061904597,醴陵市来龙门办事处金融路17号,113.508667,27.669572
2063205125,醴陵市明月镇新台村胜利组,113.345535,27.393421
2063205106,醴陵市明月镇大障居委会东风组6号,113.418270,27.459629
2063205066,醴陵市贺家桥镇明月居委会怡顺组,113.496894,27.646130
2063102088,醴陵市阳三石办事处泉湖工农路7号,113.513253,27.652874
2063102077,醴陵市大桥南路,113.511426,27.656268
2063118141,醴陵市太一街市场E栋1号,113.496659,27.652969
2063118178,醴陵市太一街E栋11号,113.497166,27.653038
2063205212,醴陵市明月镇云岩居委会田心组,113.496894,27.646130
2063205079,醴陵市明月镇庆贺居委会庆贺路,113.421777,27.457946
2063118170,醴陵市招待所9号门面,113.496894,27.646130
2063205087,醴陵市大障镇滨河路59号,113.496233,27.660392
2063205069,醴陵市明月镇大障居委会庆贺路52号,113.421777,27.457946
2063205075,醴陵市明月镇东江村瑶前组,113.410156,27.477904
2063205048,醴陵市大障镇滨河路10号,113.414188,27.458535
2063203249,醴陵市李畋镇南桥居委会南桥组263号,113.678580,27.844911
2063209245,醴陵市板杉镇东冲铺村马义台组,113.441695,27.704528
2063118191,醴陵市太一市场综合管理所一号门面,113.496710,27.653029
2063104010,醴陵市中山南路198号,113.502975,27.648767
2063204091,醴陵市西山办事处万宜村,113.503918,27.624632
2063105306,醴陵市胜利路商大电器旁,113.497797,27.656112
2063218505,醴陵市东堡乡东堡村陈家湾组,113.525700,27.714711
2063205137,醴陵市明月镇新联村和平组8号,113.434405,27.462969
2063205054,醴陵市明月镇陶家垅村双桥组,113.464249,27.473057
2063104024,醴陵市西山办事处左权路121号,113.501442,27.645373
2063205209,醴陵市明月镇大障居委会庆贺路,113.421777,27.457946
2063218953,醴陵市王坊镇渌石村四上组,113.613262,27.680656
2063104029,醴陵市阳三办事处企石村老屋组18号,113.548530,27.669025
2063104027,醴陵市仙岳山街道市府路132号,113.499298,27.644042
2063105240,醴陵市来龙门瓜畲坪11号101室,113.499957,27.656429
2063205188,醴陵市孙家湾乡孙家湾村安脚组28号,113.510917,27.595950
2063204083,醴陵市西山办事处石成金村松山塘组7号,113.485761,27.606302
2063205004,醴陵市仙岳山街道石成金村群力组,113.485761,27.606302
2063204017,醴陵市泗汾镇林田居委会四季桥组8号,113.496505,27.514071
2063205172,醴陵市仙岳山街道万宜村枫树组300号,113.503918,27.624632
2063207334,醴陵市石亭镇花溪村,113.237045,27.611131
2063204002,醴陵市孙家湾乡龙虎湾村,113.508943,27.569007
2063204005,醴陵市孙家湾乡龙虎湾村,113.508943,27.569007
2063218954,醴陵市王仙镇庄埠村国道组,113.574281,27.693343
2063104053,醴陵市西山办事处中山南路257号,113.502342,27.649234
2063104056,醴陵市西山办事处中山南路282号,113.510506,27.639978
2063218637,醴陵市孙家湾乡孙家湾村阁公塘组,113.510917,27.595950
2063104064,醴陵市仙岳山街道江源路8号,113.492375,27.657250
2063105207,醴陵市东风市场45号,113.499750,27.657083
2063218489,醴陵市王仙镇庄埠村山下组65号,113.574281,27.693343
2063105065,醴陵市解放路东风巷14号,113.500885,27.657398
2063205008,醴陵市孙家湾乡西岸村,113.467914,27.584963
2063205006,醴陵市孙家湾镇西岸村,113.467914,27.584963
2063205082,醴陵市孙家湾道姑岭村,113.555358,27.766781
2063205094,醴陵市孙家湾乡西岸村,113.467914,27.584963
2063204007,醴陵市孙家湾乡龙虎湾村,113.508943,27.569007
2063204105,醴陵市孙家湾乡龙虎湾村,113.508943,27.569007
2063218504,醴陵市泗汾镇茶埠塘村黄井塘组12号,113.479382,27.500785
2063206187,醴陵市泗汾镇枧上村上狮组2号,113.513264,27.536051
2063206189,醴陵市泗汾镇枧上村红屋组44号,113.513264,27.536051
2063218501,醴陵市均楚镇均楚桥居委会,113.270988,27.570809
2063104098,醴陵市仙岳山街道南门立新街50号,113.505255,27.646837
2063205009,醴陵市孙家湾镇西岸村,113.467914,27.584963
2063205145,醴陵市嘉树镇玉茶村香木塘组,113.455813,27.574159
2063204001,醴陵市仙岳山街道滴水井村石灰塘组,113.509706,27.607835
2063204175,醴陵市孙家湾乡龙虎湾村,113.508943,27.569007
2063204134,醴陵市西山办事处滴水井村,113.509706,27.607835
2063105118,醴陵市胜利路123号,113.498299,27.654577
2063204170,醴陵市孙家湾镇孙家湾村角公塘组1号,113.510917,27.595950
2063204171,醴陵市孙家湾乡孙家湾村坝下组,113.510917,27.595950
2063205121,醴陵市孙家湾镇孙家湾村,113.510917,27.595950
2063105265,醴陵市刘家巷9号门面,113.496893,27.654046
2063105308,醴陵市来龙门办事处刘家巷4号门面,113.496893,27.654046
2063205071,醴陵市嘉树镇嘉树村牛栏组,113.432824,27.554209
2063101026,醴陵市西山办事处碧山村大王坪组,113.508470,27.637995
2063205120,醴陵市嘉树镇嘉树村钟家组,113.432824,27.554209
2063101020,醴陵市阳三办事处泉湖路29号,113.500664,27.660091
2063104169,醴陵市仙岳山街道南门社区正兴街43号,113.502979,27.645310
2063203257,醴陵市东堡乡东堡村文家组33号,113.525700,27.714711
2063101011,醴陵市石坝市场,113.512250,27.650771
2063105129,醴陵市来龙门办事处刘家巷3号,113.497480,27.654390
2063104167,醴陵市仙岳山街道江源开发区左权北路4号,113.493024,27.657603
2063105123,醴陵市胜利路78号,113.498308,27.653808
2063204051,醴陵市船湾镇金子坪居委会106号,113.503225,27.423153
2063105137,醴陵市来龙门办事处胜利路56号,113.498863,27.653289
2063205115,醴陵市嘉树乡嘉树村群力组,113.432824,27.554209
2063101038,醴陵市仙岳山街道碧山村26号,113.508470,27.637995
2063205078,醴陵市嘉树乡杉仙村新胜组5号,113.425754,27.531619
2063218497,醴陵市白兔潭镇文化路134号,113.668727,27.789341
2063101076,醴陵市仙岳山街道南门市场门口4号,113.511536,27.639041
2063105319,醴陵市中心街5号,113.499895,27.653596
2063105127,醴陵市胜利路55号,113.498752,27.653343
2063105252,醴陵市解放路来龙门办事处来龙门22号1栋103,113.509956,27.670216
2063105283,醴陵市来龙门28号,113.509956,27.670216
2063105128,醴陵市中心街1号,113.500995,27.653700
2063106407,醴陵市城东市场一塘39号,113.504547,27.663267
2063205183,醴陵市嘉树镇井新村新屋组6号,113.430474,27.552429
2063205028,醴陵市明月镇马恋村马恋组12号,113.385794,27.492762
2063206046,醴陵市沈潭镇美田桥村,113.623766,27.509657
2063206049,醴陵市沈潭镇柞市村,113.588629,27.489928
