id,address,longitude,latitude
2051315024,炎陵县船形乡新生圩,113.671131,26.298754
2051806201,炎陵县船形乡同睦村圩上,113.671172,26.333514
2051405001,炎陵县霞阳镇井冈西路42号,113.772383,26.489703
2051313086,炎陵县鹿原镇天星村,113.644518,26.406884
2051313075,炎陵县鹿原镇神农大道商住楼小区,113.664676,26.431113
2051314008,炎陵县鹿原镇金山村,113.620804,26.346695
2051314009,炎陵县鹿原镇东风村太坪岭墟,113.664676,26.431113
2051314003,炎陵县鹿原镇金山村上方组,113.620804,26.346695
2051314023,炎陵县鹿原傎三口村新塘组,113.772655,26.489902
2051314030,炎陵县鹿原镇太平岭村太平岭圩,113.626731,26.358118
2051314011,炎陵县鹿原镇东风圩,113.664676,26.431113
2051314014,炎陵县鹿原镇东风村太平岭圩,113.626731,26.358118
2051314018,炎陵县鹿原镇三口村大陂头组06号,113.610142,26.401473
2051315009,炎陵县船形乡船形村烟泷组,113.660118,26.275315
2051505007,炎陵县霞阳镇解放路44-23号,113.776575,26.484541
2051405015,炎陵县霞阳镇井冈西路17-13号,113.770904,26.488953
2051605018,炎陵县霞阳镇文化路中天小区1栋5号门面,113.775527,26.486814
2051805038,炎陵县霞阳镇边贸市场45-26门面,113.778289,26.491545
2051805034,炎陵县霞阳镇炎陵东路与鹿原路交叉口西南50米,113.780489,26.491813
2051806477,炎陵县霞阳镇霍家村圩背组,113.683502,26.470228
2051805041,炎陵县霞阳镇炎陵东路,113.781174,26.490965
2051805028,炎陵县霞阳镇炎陵西路,113.770929,26.486698
2051805029,炎陵县霞阳镇炎陵东路安居6栋4号,113.780454,26.490716
2051805018,炎陵县霞阳镇炎陵西路房地产门面八号,113.770929,26.486698
2051705037,炎陵县霞阳镇炎陵东路13号,113.781174,26.490965
2051805010,炎陵县霞阳镇炎陵西路安居8栋1号,113.772154,26.486768
2051705002,炎陵县霞阳镇文化路42号,113.776860,26.485063
2051805003,炎陵县霞阳镇炎陵西路,113.770929,26.486698
2051405034,炎陵县霞阳镇井冈中路梓园小区门口,113.773311,26.490438
2051705009,炎陵县霞阳镇米泉路,113.779950,26.489106
2051405050,炎陵县霞阳镇井冈东路二轻局门面,113.776025,26.491051
2051312005,炎陵县霞阳镇九龙工业园,113.728589,26.485136
2051210009,炎陵县中村瑶族乡红星桥村,113.772655,26.489902
2051505002,炎陵县霞阳镇解放路26号工商局门面,113.775164,26.486205
2051211008,炎陵县策源乡梁桥村黄家洲组,113.962473,26.400052
2051305050,炎陵县霞阳镇边贸市场北路口,113.778639,26.480043
2051208079,炎陵县水口镇新市场,113.810157,26.319938
2051102011,炎陵县沔渡镇夏馆村,113.891659,26.587985
2051305056,炎陵县霞阳镇井冈东路50-4号,113.779442,26.492796
2051102007,炎陵县沔渡镇泮坑村坎上组19号,113.910677,26.592162
2051101006,炎陵县十都镇神农谷村竹山下组,113.940704,26.547393
2051806948,炎陵县中村瑶族乡红星桥市场,113.771126,26.134432
2051101010,炎陵县十都镇神农谷村,113.940704,26.547393
2051101017,炎陵县十都镇晓东村团结组,113.947539,26.543345
2051806402,炎陵县鹿原镇澎溪村,113.662904,26.358108
2051806385,炎陵县船形乡桐睦村井塘组20号,113.666823,26.308663
2051806486,炎陵县水口镇水口圩,113.810157,26.319938
2051806393,炎陵县霞阳镇草坪村,113.801655,26.468241
2051806404,炎陵县鹿原镇澎溪村,113.662904,26.358108
2051806963,炎陵县天华10栋101号门面,113.772655,26.489902
2051806756,炎陵县中村瑶族乡梅岗村,113.776019,26.253234
2051807014,炎陵县霞阳镇井岗东路75号金鑫花苑二小区A栋,113.783039,26.493974
2051807011,炎陵县霞阳镇文化路42号,113.776860,26.485063
2051807012,炎陵县霞阳镇霞阳路（正泰新城）,113.786616,26.485149
2051806695,炎陵县霞阳镇溪源路18号,113.779030,26.490846
2051806692,炎陵县下村乡同乐村老圩组24号,113.904374,26.225955
2051206036,炎陵县下村乡同乐村下村圩,113.904374,26.225955
2051103032,炎陵县垄溪乡古塘村08号,113.859261,26.402846
2051806965,炎陵县石洲乡安坑村,113.908727,26.489154
2051206038,炎陵县下村乡坳头村沙坝组,113.880736,26.204171
2051806761,炎陵县水口镇桥头,113.849357,26.333421
2051806978,炎陵县霞阳镇解放路时代公寓117室,113.782341,26.481009
2051206039,炎陵县下村乡酃峰村,113.903088,26.223027
2051806949,炎陵县霞阳镇神农大道天华小区,113.783204,26.479767
2051806844,炎陵县霞阳镇塘垄村排上组,113.834757,26.500735
2051806760,炎陵县十都镇桃源区,113.940704,26.547393
2051901312,炎陵县沔渡镇晓阳村黄岭路,113.864590,26.575363
2051807010,炎陵县船形乡同睦村,113.671172,26.333514
2051605029,炎陵县霞阳镇建材市场6号门面,113.778639,26.480043
2051806765,炎陵县沔渡镇晓阳村晓阳大道,113.864590,26.575363
2051806903,炎陵县沔渡镇晓阳村晓阳大道,113.864590,26.575363
2051806762,炎陵县霞阳镇解放路50-2号,113.777417,26.484078
2051806766,炎陵县霞阳镇井冈西路9号,113.772383,26.489703
2051806904,炎陵县九龙工业园,113.728589,26.485136
2051807019,炎陵县霞阳镇神农大道华联二小区16号楼,113.768511,26.485109
2051807018,炎陵县鹿原镇新坪村冷水井组19号,113.667822,26.400720
2051313043,炎陵县鹿原镇王家渡圩,113.664676,26.431113
2051104042,炎陵县沔渡镇石坝村石洲圩,113.916097,26.468347
2051806906,炎陵县沔渡镇商贸街,113.865486,26.575154
2051806938,炎陵县下村乡同乐村,113.904374,26.225955
2051806770,炎陵县霞阳镇解放路西苑小区2栋105号,113.780042,26.481873
2051970015,炎陵县水口镇渣村村桥头组,113.805468,26.293632
2051806991,炎陵县十都镇开发区桃源大道,113.940704,26.547393
2051806773,炎陵县霞阳镇坎坪路,113.782241,26.483409
2051211037,炎陵县策源乡上洞村石禾坪,114.002133,26.371714
2051101060,炎陵县十都镇开发区,113.940704,26.547393
2051104041,炎陵县沔渡镇石坝村石坝圩,113.918282,26.466404
2051805881,炎陵县霞阳镇井冈东路64号,113.782110,26.493321
2051208034,炎陵县水口镇木湾村双园04号,113.784324,26.369529
2051805884,炎陵县解放路百货大楼,113.772707,26.489217
2051805885,炎陵县霞阳镇洣泉路61号,113.772200,26.488850
2051312057,炎陵县霞阳镇九龙村,113.778639,26.480043
2051806775,炎陵县霞阳镇炎陵东路东门组大楼门面,113.781174,26.490965
2051806783,炎陵县霞阳镇九龙村罗家组,113.778639,26.480043
2051806782,炎陵县霞阳镇九龙村华山组,113.778639,26.480043
2051806944,炎陵县星光村排上组,113.702043,26.478894
2051806994,炎陵县霞阳镇井冈东路金鑫花苑,113.783106,26.494551
2051806995,炎陵县霞阳镇炎陵东路牌坊下居民小组集资楼5号门面,113.781174,26.490965
2051970008,炎陵县水口镇水口村,113.807944,26.326633
2051970009,炎陵县草坪村林盛家园4栋2号车库,113.799834,26.472247
2051807024,炎陵县草坪村和顺家园,113.800437,26.472730
2051806877,炎陵县沔渡镇狮头村狮头组,113.829549,26.567802
2051806875,炎陵县三河镇霍家圩,113.678640,26.461753
2051806894,炎陵县霞阳镇井冈东路52-12号,113.780001,26.492467
2051806889,炎陵县霞阳镇文化路,113.776018,26.486698
2051806890,炎陵县霞阳镇文化路桥桥头,113.661524,26.443454
2051806892,炎陵县霞阳镇北环路31号,113.771889,26.495403
2051806880,炎陵县解放路汽车队2-14-15号门面,113.775290,26.485223
2051806881,炎陵县霞阳镇霞阳路景龙国际A-106栋,113.786900,26.487883
2051806882,炎陵县霞阳镇解放路水电局7号门面,113.775290,26.485223
2051806896,炎陵县龙渣乡红星桥,113.771126,26.134432
2051806883,炎陵县中村乡中村村,113.768019,26.205462
2051806884,炎陵县霞阳镇颜家村,113.798809,26.500672
2051806879,炎陵县霞阳镇井冈路81号金鑫花苑一小区A栋2号,113.785813,26.495701
2051806886,炎陵县中村乡龙潭村邱家组,113.769108,26.158606
2051806876,炎陵县十都镇上井村,113.992636,26.593748
2051901310,炎陵县水口镇水口村水口东路02号,113.831810,26.322370
2051807035,炎陵县霞阳镇文化南路与解放路交叉口东北50米,113.775290,26.485223
2051970003,炎陵县霞阳镇霞阳路东山明珠4号门面,113.785963,26.491558
2051209009,炎陵县中村瑶族乡平乐村平乐圩,113.772655,26.489902
2051970004,炎陵县霞阳镇草坪村林盛小区内5-1号,113.801655,26.468241
2051807039,炎陵县中村乡中村墟,113.768019,26.205462
2051101003,炎陵县十都镇青石岗村大坝组,114.037588,26.543421
2051405029,炎陵县霞阳镇解放路安居13栋门面,113.773083,26.489376
2051207030,炎陵县中村瑶族乡中村村中村圩乡政府门面,113.768019,26.205462
2051805058,炎陵县霞阳镇炎陵东路607号,113.781174,26.490965
2051105014,炎陵县霞阳镇黄沙垅村春塘医疗室,113.801955,26.478957
2051806924,炎陵县中村乡深渡村八字坑组,113.778091,26.180610
2051312068,炎陵县霞阳镇霍家村霍家圩,113.683502,26.470228
2051970045,炎陵县霞阳镇解放路9号,113.775290,26.485223
2051806922,炎陵县沔渡镇晓阳大道09号,113.865486,26.575154
2051104015,炎陵县沔渡镇太源村太源组36号,113.865486,26.575154
2051970001,炎陵县鹿原镇天杰家居城119号-121号,113.664676,26.431113
2051313011,炎陵县鹿原镇河西桥桥头,113.674571,26.412927
2051315023,炎陵县船形乡新生圩,113.671131,26.298754
2051970021,炎陵县大院农场七队,113.772655,26.489902
2051806872,炎陵县下村乡下村圩,113.903088,26.223027
2051807041,炎陵县霞阳镇霞阳路正泰新城A3号,113.787589,26.486062
2051807042,炎陵县霞阳镇正泰新城C1栋,113.787780,26.485213
2051970041,炎陵县霞阳镇九龙工业区,113.728589,26.485136
2051806921,炎陵县三河镇星光村排上组,113.702043,26.478894
2051807043,炎陵县霞阳镇炎陵中路,113.779523,26.490134
2051806913,炎陵县中村乡龙坪村上湾组,113.765647,26.245490
2051970023,炎陵县沔渡镇石坝村农贸市场,113.865486,26.575154
2051970024,炎陵县霞阳镇洣泉路安居3栋,113.782196,26.490549
2051313084,炎陵县玉江村上玉江组,113.655871,26.456675
2051970030,炎陵县霞阳镇炎陵西路,113.770929,26.486698
2051806914,炎陵县边贸市场,113.778289,26.491545
2051807031,炎陵县船形乡船形村下桥组,113.660118,26.275315
2051970010,炎陵县霞阳镇解放路延伸段（天华小区）,113.783204,26.479767
2051970031,炎陵县霞阳镇霞阳大道和一公馆6栋103门面,113.788670,26.484423
2051806916,炎陵县石洲乡青石村,113.940597,26.453076
2051807006,炎陵县霞阳镇神农大道和顺家园7栋10号,113.802360,26.470932
2051807005,炎陵县水口镇水口圩,113.810157,26.319938
2051807003,炎陵县船形乡新生村船铺里组60号,113.670541,26.298127
2051970012,炎陵县霞阳镇井岗路中团村（火车站）,113.783605,26.499669
2051805069,炎陵县霞阳镇东山开发区山下小区第5排,113.788197,26.490011
2051806917,炎陵县东风乡西草坪村桥头组25号,113.629202,26.371196
2051101033,炎陵县十都镇桃源大道28号,113.940704,26.547393
2051807026,炎陵县沔渡镇夏馆村开发区8号,113.865486,26.575154
2051807028,炎陵县垅溪乡垅溪圩,113.804830,26.435748
2051970016,炎陵县霞阳镇霞阳大道和一公馆8栋,113.788528,26.482095
2051314031,炎陵县鹿原镇东风村东风圩,113.664676,26.431113
2051805607,炎陵县沔渡镇沔渡圩,113.865486,26.575154
2051806923,炎陵县霞阳镇井冈路60号,113.780752,26.492793
2051970017,炎陵县霞阳镇井冈西路,113.772383,26.489703
2051805608,炎陵县霞阳镇井冈路12号,113.774690,26.490572
2051970032,炎陵县平乐乡乐富村刘家06号,113.855121,26.170734
2051970047,炎陵县霞阳镇解放路22号,113.775130,26.486281
2051806931,炎陵县九龙工业园,113.728589,26.485136
2051970019,炎陵县霞阳镇霞阳大道和一公馆7栋104号门面,113.788863,26.483460
2052970046,炎陵县沔渡镇晓阳村桥下组,113.864590,26.575363
2051805609,炎陵县十都镇洋歧村,113.972523,26.534097
2051208055,炎陵县水口镇水口圩,113.810157,26.319938
2051705006,炎陵县霞阳镇坎坪村坪头岭组,113.787354,26.480210
2051807000,炎陵县霞阳镇文化路,113.776018,26.486698
2051807001,炎陵县霞阳镇霞阳大道和一公馆10栋108号门面,113.787702,26.480516
2051305049,炎陵县霞阳镇井冈东路（中团村店下组）,113.781059,26.493332
2051208075,炎陵县水口镇自源村,113.861784,26.286833
2051806910,炎陵县霞阳镇解放路,113.775290,26.485223
2051806911,炎陵县水口镇渣村,113.805468,26.293632
2051806807,炎陵县沔渡镇苍背村砖下组,113.901883,26.600264
2051806803,炎陵县天平村下屋组28号,113.675496,26.455528
2051806808,炎陵县鹿原镇洣西村委会7号门面,113.664676,26.431113
2051315035,炎陵县船形乡船形圩,113.671131,26.298754
2051805612,炎陵县鹿原镇东风村东风圩,113.664676,26.431113
2051806804,炎陵县霞阳镇黄沙垄村中心31号,113.778639,26.480043
2051805613,炎陵县霞阳镇五里排村黄土坳组,113.745433,26.481514
2051313078,炎陵县鹿原镇玉江村,113.655871,26.456675
2051805614,炎陵县鹿原路6号（原检察院宿舍门面）,113.780364,26.491668
2051805615,炎陵县船形乡新生墟,113.671131,26.298754
2051805616,炎陵县鹿原镇塘田墟,113.664676,26.431113
2051970027,炎陵县船形乡新生村船铺里组94号,113.670541,26.298127
2051805618,炎陵县沔渡镇晓阳村晓阳大楼一楼,113.864590,26.575363
2051806953,炎陵县鹿原镇新坪村冷水井组,113.667822,26.400720
2051805619,炎陵县沔渡镇下关村老古庙组,113.899101,26.593207
2051805624,炎陵县霞阳镇炎陵东路霞阳派出所旁,113.781558,26.491151
2051970013,炎陵县鹿原镇湖田村东边组,113.657113,26.422262
2051806955,炎陵县平乐乡井山村,113.840121,26.154021
2051806954,炎陵县龙渣乡龙渣村,113.782908,26.141109
2051805626,炎陵县霞阳镇炎陵西路86号,113.768902,26.485513
2051806957,炎陵县中村乡联西村梨花组,113.759660,26.212720
2051806951,炎陵县龙渣瑶族乡新开村下洞组,113.770253,26.143189
2051208033,炎陵县水口镇小湾村,113.828663,26.292035
2051805627,炎陵县十都镇晓东村西正街,113.943386,26.545324
2051901313,炎陵县霞阳镇吉利村村委会,113.778639,26.480043
2051313085,炎陵县鹿原镇西塘村,113.648303,26.481205
2051805628,炎陵县沔渡镇沔渡圩,113.865486,26.575154
2051314035,炎陵县鹿原镇三口村三口圩,113.611300,26.397628
2051207006,炎陵县中村瑶族乡梅岗村窑窝37号,113.776019,26.253234
2051101036,炎陵县十都镇黄上村,113.973042,26.588750
2051208006,炎陵县水口镇水口村水口圩,113.807944,26.326633
2051208077,炎陵县水口镇自源村泥江洲组30号,113.861784,26.286833
2051705013,炎陵县霞阳镇文化路38号民政局第2号门面,113.776759,26.485238
2051211009,炎陵县策源乡梁桥村电站旁,113.907150,26.351763
2051312041,炎陵县霞阳镇霍家村霍家圩,113.683502,26.470228
2051805629,炎陵县中村瑶族乡中村村田心组,113.768019,26.205462
2051305018,炎陵县霞阳镇井冈东路38-7号,113.777860,26.491650
2051312014,炎陵县霞阳镇九龙村九龙工业园,113.728589,26.485136
2051312060,炎陵县霞阳镇霍家墟,113.778639,26.480043
2051405016,炎陵县霞阳镇井冈西路10号,113.772383,26.489703
2051405028,炎陵县霞阳镇解放路安居13栋7号门面,113.773083,26.489376
2051805630,炎陵县十都镇大院农场桥头,113.940704,26.547393
2051102013,炎陵县沔渡镇夏馆村老古庙组,113.891659,26.587985
2051313066,炎陵县鹿原镇塘田圩,113.664600,26.404520
2051101012,炎陵县十都镇桃源洞,114.044546,26.491744
2051901314,炎陵县霞阳镇神农大道建材市场,113.771654,26.483697
2051101023,炎陵县十都镇桃源大道,113.940704,26.547393
2051314032,炎陵县鹿原镇东风村下木山组,113.664676,26.431113
2051806017,炎陵县十都镇车溪村安家组,113.927789,26.562402
2051206034,炎陵县下村乡下村圩,113.903088,26.223027
2051101028,炎陵县十都镇晓东村坪寨路,113.947539,26.543345
2051103015,炎陵县垄溪乡菜坪村船坑组14号,113.852116,26.467420
2051102002,炎陵县沔渡镇上馆村田心04号,113.941983,26.594070
2051102021,炎陵县沔渡镇仓背村神农瓷场,113.901883,26.600264
2051101058,炎陵县十都镇新市场边,113.940704,26.547393
2051102080,炎陵县沔渡镇沔渡圩晓阳路40号,113.863855,26.575159
2051102037,炎陵县沔渡镇沔渡圩,113.865486,26.575154
2051970014,炎陵县鹿原镇洣西村塘村组30号,113.664676,26.431113
2051104038,炎陵县沔渡镇石坝村石洲组,113.918282,26.466404
2051805992,炎陵县十都镇洋岐畲族村新屋28号,113.967686,26.539272
2051208039,炎陵县水口镇协成村板桥组,113.810157,26.319938
2051207045,炎陵县中村瑶族乡梅岗村,113.776019,26.253234
2051210010,炎陵县龙渣乡市场公安派出所旁边,113.772655,26.489902
2051211005,炎陵县策源乡下坪村,113.945594,26.391379
2051901315,炎陵县霞阳镇神农大道,113.780393,26.479533
2051208072,炎陵县下村乡同乐村下村圩,113.904374,26.225955
2051305057,炎陵县霞阳镇井冈东路邮政大楼门面,113.777946,26.491379
2051312021,炎陵县九龙工业园,113.728589,26.485136
2051313077,炎陵县鹿原镇湖田村,113.657113,26.422262
2051314002,炎陵县鹿原镇东风村太平岭圩,113.626731,26.358118
2051312071,炎陵县三河镇三河圩,113.678640,26.461753
2051805012,炎陵县霞阳镇新市街36号,113.771918,26.485843
2051313063,炎陵县鹿原镇塘田圩,113.664600,26.404520
2051405052,炎陵县霞阳镇北环路37号,113.772152,26.495528
2051605021,炎陵县霞阳镇文化路（大华宾馆门面）,113.777405,26.484798
2051806899,炎陵县霞阳镇炎陵路安居39栋8号,113.771217,26.486504
2051806900,炎陵县龙渣乡龙渣圩,113.782908,26.141109
2051806863,炎陵县霞阳镇霞阳路18号1栋,113.783980,26.491910
2051901316,炎陵县霞阳镇霞阳大道（顺昌宾馆门面）,113.787720,26.481567
2051901317,炎陵县霞阳镇解放路延伸段,113.775290,26.485223
2051900890,炎陵县沔渡镇晓阳村,113.864590,26.575363
2051901307,炎陵县垄溪乡农贸市场,113.804830,26.435748
2051970034,炎陵县沔渡镇石坝村,113.918282,26.466404
2051970007,炎陵县十都镇桃源大道,113.940704,26.547393
2051315042,炎陵县船形乡沿潭村下沿潭组,113.696481,26.261350
2051970035,炎陵县霞阳镇石鼓村横江组,113.724165,26.491945
2051806812,炎陵县霞阳镇解放路,113.775290,26.485223
2051901308,炎陵县霞阳镇炎陵中路中天花园小区,113.776868,26.488781
2051970036,炎陵县十都珍晓东村桃源大道,113.772655,26.489902
2051901309,炎陵县霞阳镇县府路25号,113.772227,26.490645
2051312073,炎陵县三河镇枧田洲村,113.659552,26.446722
2051206040,炎陵县下村乡小横溪村,113.903088,26.223027
2051206027,炎陵县下村乡云里村学堂组22号,113.922763,26.227036
2051312015,炎陵县三河镇深坑村九龙工业区,113.728589,26.485136
2051970037,炎陵县霞阳镇颜家村回垅仙,113.790256,26.513156
2051312002,炎陵县霞阳镇九龙工业园,113.728589,26.485136
2051970038,炎陵县霞阳镇神农大道延伸段（山水星城门面）,113.790620,26.476639
2051970039,炎陵县霞阳镇炎陵东路,113.781174,26.490965
2051505031,炎陵县霞阳镇县府路东01号,113.773650,26.490243
2051805005,炎陵县霞阳镇炎陵西路安居11栋1号,113.770929,26.486698
2051970040,炎陵县霞阳镇霞阳大道（正泰新城）,113.786616,26.485149
2051805032,炎陵县霞阳镇神农大道(摩托车大市场门口),113.780393,26.479533
2051970048,炎陵县霞阳镇解放路45号,113.774875,26.487268
2051970043,炎陵县沔渡镇晓阳村金三角,113.864590,26.575363
2051970044,炎陵县霞阳镇颜家村回垅仙组,113.798809,26.500672
2051705035,炎陵县霞阳镇井冈东路(小西苑宾馆对面),113.783488,26.493991
2051305006,炎陵县霞阳镇井冈东路（县公安局旁）,113.776025,26.491051
2051102059,炎陵县沔渡镇石桥村潭头湾37号,113.890857,26.529918
2051208073,炎陵县水口镇联坑村上坑18号,113.800144,26.302000
2051206012,炎陵县下村乡下村圩,113.903088,26.223027
2051313026,炎陵县鹿原镇供销社门面,113.774842,26.488774
2051210001,炎陵县中村瑶族乡红星桥村圩上,113.772655,26.489902
2051208028,炎陵县水口镇浆村村,113.848454,26.329492
2051313070,炎陵县鹿原镇塘田圩,113.664600,26.404520
2051104040,炎陵县沔渡镇石洲圩,113.916097,26.468347
2051314001,炎陵县鹿原镇西草坪村,113.629202,26.371196
2051207011,炎陵县中村瑶族乡梅岗村桐坑组,113.776019,26.253234
2051970042,炎陵县水口镇枣树村祠堂下17号,113.792944,26.274717
2051101035,炎陵县十都镇开发区,113.940704,26.547393
2051314034,炎陵县鹿原镇三口村,113.610142,26.401473
2051208076,炎陵县水口镇水口圩供销社门面,113.810157,26.319938
2051313072,炎陵县鹿原镇塘旺村,113.670567,26.436709
2051208081,炎陵县龙溪乡江洲村江口组,113.774497,26.416388
2051970053,炎陵县策源乡竹园村瓷器窑组,113.917856,26.342391
2052970049,炎陵县中村瑶族乡新开村红星排组,113.770253,26.143189
2052970050,炎陵县下村乡云里村横岭下组,113.922763,26.227036
2052970051,炎陵县鹿原镇塘旺村上草坪组,113.670567,26.436709
2052970052,炎陵县霞阳镇坎坪村三里亭组,113.787354,26.480210
2051211036,炎陵县策源乡平湖村平湖组,113.952501,26.367875
2051312056,炎陵县霞阳镇潘家村,113.778639,26.480043
2051312033,炎陵县霞阳镇星光村,113.702043,26.478894
2051315041,炎陵县船形乡沿潭村沿潭组,113.696481,26.261350
2051206041,炎陵县下村乡下村圩,113.903088,26.223027
2051206005,炎陵县下村乡云里村,113.922763,26.227036
2051208017,炎陵县水口镇水口圩商贸街,113.808479,26.319965
2051208066,炎陵县水口镇平岗村仙背26号,113.810157,26.319938
2051211016,炎陵县策源乡良桥村,113.962473,26.400052
2051312031,炎陵县霞阳镇霍家村霍家圩,113.683502,26.470228
2051209013,炎陵县中村瑶族乡鑫山村青广坪组,113.863136,26.152619
2051315031,炎陵县船形乡新生圩,113.671131,26.298754
2051209016,炎陵县中村瑶族乡平乐村,113.772655,26.489902
2051207026,炎陵县中村瑤族乡心田村,113.772031,26.230043
2051312038,炎陵县霞阳镇霍家村霍家圩,113.683502,26.470228
2051305015,炎陵县霞阳镇井冈东路,113.776025,26.491051
2051206044,炎陵县下村乡酃峰村黄家塘10号,113.972623,26.274590
2051314037,炎陵县鹿原镇东风村东风圩,113.664676,26.431113
2051102055,炎陵县沔渡镇洞里村,113.879523,26.546468
2051312025,炎陵县霞阳镇九龙村,113.778639,26.480043
2051505014,炎陵县霞阳镇解放路,113.775290,26.485223
2051312062,炎陵县霞阳镇九龙村九龙工业园,113.728589,26.485136
2051103035,炎陵县垄溪乡三口村柏树下组,113.804830,26.435748
2051312034,炎陵县霞阳镇霍家村霍家圩,113.683502,26.470228
2051312059,炎陵县九龙工业区,113.728589,26.485136
2051208084,炎陵县水口镇自源村桥头,113.861784,26.286833
2051805075,炎陵县霞阳镇苏洲路8号,113.778072,26.490245
2051209017,炎陵县中村瑶族乡平乐圩,113.772655,26.489902
2051805074,炎陵县霞阳镇炎陵中路步行街,113.776680,26.488746
2051705023,炎陵县霞阳镇湘山摩托车大市场,113.771633,26.484029
2051313045,炎陵县鹿原镇王家渡圩,113.664676,26.431113
2051605026,炎陵县霞阳镇文化路（南站候车厅内）,113.776750,26.484167
2051314015,炎陵县鹿原镇东风村太平岭圩21号,113.626731,26.358118
2051315002,炎陵县鹿原镇澎溪村鲁坑组09号,113.662904,26.358108
2051313018,炎陵县鹿原镇王家渡圩,113.664676,26.431113
2051705007,炎陵县霞阳镇黄沙垄村,113.801955,26.478957
2051805017,炎陵县霞阳镇西正街29号,113.771744,26.486775
2051207039,炎陵县中村乡中村圩73号,113.768019,26.205462
2051312076,炎陵县霞阳镇西台村,113.667752,26.464232
2051103036,炎陵县垄溪乡坂溪村大屋12号,113.842019,26.441989
2051102088,炎陵县沔渡镇下关村下关圩,113.899101,26.593207
2051101073,炎陵县十都镇坪寨路,113.940704,26.547393
2051101074,炎陵县十都镇开发区,113.940704,26.547393
2051805078,炎陵县霞阳镇炎陵东路,113.781174,26.490965
2051103037,炎陵县垄溪乡垄溪圩,113.804830,26.435748
2051208097,炎陵县水口镇浆村村,113.848454,26.329492
2051207047,炎陵县中村瑶族乡龙潭村新屋组24号,113.769108,26.158606
2051405063,炎陵县霞阳镇井岗中路梓园小区,113.773311,26.490438
2051105037,炎陵县霞阳镇颜家村高水桥头,113.798809,26.500672
2051211038,炎陵县策源乡策源圩,113.907150,26.351763
2051313117,炎陵县鹿原镇天星村井下23号,113.644518,26.406884
2051209020,炎陵县中村瑶族乡康乐村,113.772655,26.489902
2051208096,炎陵县水口镇桃源村郭家组,113.823938,26.298251
2051313115,炎陵县鹿原镇塘田圩,113.664600,26.404520
2051505054,炎陵县霞阳镇解放路10号,113.774204,26.487326
2051405064,炎陵县霞阳镇井冈中路,113.773494,26.490082
2051312081,炎陵县霞阳镇霍家墟,113.778639,26.480043
2051105021,炎陵县霞阳镇草坪村,113.801655,26.468241
2051101018,炎陵县十都镇晓东村新圩组(西正街),113.943386,26.545324
2051101016,炎陵县十都镇晓东村新圩组西正街178号,113.943386,26.545324
2051104043,炎陵县沔渡镇青石村青石组12号,113.940597,26.453076
2051102089,炎陵县沔渡镇洞里村城上18号,113.879523,26.546468
2051103033,炎陵县垄溪乡三口龙村桂前组,113.798279,26.438323
2051315033,炎陵县船形乡新生村新生圩,113.670541,26.298127
2051315037,炎陵县船形乡新生圩,113.671131,26.298754
2051102078,炎陵县沔渡镇沔渡圩农贸市场内,113.865486,26.575154
